Paradise Lost: a poem in twelve books [NEED TO LOOK AT COPY AGAIN - COULD BE FACSIMILE REPRINT],"Milton, John",,,1784,Printed for John Sharpe,#VALUE!,"Omni catalogue has this copy dated for 1822, however, the tp dates it as 1784. Possible cataloguing error. ",Bound in speckled brown calf with raised bands on spine. Gilt titling over burgundy goatskin label on spine.,,A106,Special Collections,https://worldcat.org/en/title/7750354,N/A,,,,,,,,,,,
The poetical works of Mr. John Milton.,"Milton, John",,,1784,Printed for A. Millar and J. Hodges,London,4 volumes,"All volumes: Bound in yellow-brown calf. Raised bands, decorative gilt tooling, and gilt lettering over red leather on spine. ",,B233,Special Collections,,,,,,,,,,,,,
Paradise lost : a poem in twelve books,"Milton, John",,,1784,Printed for A. Millar and J. Hodges,London,283p. ,,,A99,Special Collections,,,,,,,,,,,,,
Paradise regain'd : a poem in four books : to which is added Samson Agonistes and poems upon several occasions with a tractate of education,"Milton, John",,,1785,"Printed for W. Strahan, et al",London,381p.,"Bound in brown goatskin with gilt tooling and gilt lettering over burgundy morocco label on spine. Signatue of ""Adam Adams"" on front pastedown. ",,A314,Special Collections,https://worldcat.org/en/title/24058804,https://idiscover.lib.cam.ac.uk/permalink/f/t9gok8/44CAM_CON_TRImig10000133296,Yes,,,,,,,,,,
Paradise lost : a poem in twelve books,"Milton, John",,,1785,"R. Crowder, C. Ware and T. Payne",#VALUE!,334 p.,Dark Brown leather binding with faded gilt title and raised bands on spine.,,A100,Special Collections,https://worldcat.org/en/title/13587368,https://idiscover.lib.cam.ac.uk/permalink/f/t9gok8/44CAM_CON_TRImig10000135120,,,,,,,,,,,
"
Paradise lost : a poem in twelve books","Milton, John; Fenton, Elijah",,,1785,Printed by J. Wilson,Kilmarnock,"
304 p.",dark Brown faded speckled leather binding with gilt title and raised bands on spine. Label of [John]? L Mandracchia on front pastedown.,,A101,Special Collections,https://worldcat.org/en/title/1066859076,N/A,,,,,,,,,,,
"
Paradise regain'd : a poem in four books","Milton, John",,,1785,"Printed for W. Strahan, J. F. and C. Rivington, R. Horsfield, B. White, T. Longman, [and 11 others in London] ",#VALUE!,381p.,"Bound in brown worn calf, with restored spine. Gilt tooling and titling on spine. Signature of ""John W Ellingwood"" on recto of front endpaper. ",,A125,Special Collections,https://worldcat.org/en/title/24058804,N/A,,,,,,,,,,,
The poetical preceptor : or a collection of select pieces of poetry extracted from the works of the most eminent English poets.,various authors,,,1785,Printed only for S. Crowder,#VALUE!,368p.,"Bound in brown leather with blind tooling and raised bands on spine. Gilt title over black leather on spine. Signature of ""Shelley"" October 31, 17[…?] on top of front pastedown. ",,A155,Special Collections,https://worldcat.org/en/title/1069315765,N/A,,,,,,,,,,,
Paradise regain'd : a poem in four books : to which is added Samson Agonistes and Poems upon several occasions,"Milton, John",,,1785,"Printed for W. Strahan, et al",#VALUE!,2 volumes,"Both Volumes: Bound in speckled calf with gilt rulings on cover. Decorative gilt tooling and and gilt lettering over black leather label on spine. Marbled pastedowns. Bookplate of ""Hon. William Henry Irby"" on front pastedown of both volumes. Binders ticket (C. Kalthoeber)on verso of first front endpaper of vol. 1. Illegible name inscription on top corner recto of second front endpaper. ",,B230,Special Collections,,,,,,,,,,,,,
The cabinet of genius containing frontispieces and characters adapted to the most popular poems &c. with the poems &c at large.,s.n.,,,1787,Printed for C. Taylor,#VALUE!,2 vols. ,"quarterbound green calfskin over marbled boards. Inscription on recto of front endpaper: ""Eiliza Rhodes, October 1790""",,B304,Special Collections,,,,,,,,,,,,,
Milton's Paradise lost : illustrated with texts of scripture [CATALOGUE HAS PAGE NUMBERS NEED TO REVIEW],"Milton, John",,,1788,"Printed for J. F. and C. Rivington, et al",#VALUE!,2 volumes,Both volumes bound in brown calf with gilt ruling on cover. Raised bands and gilt lettering on spine. ,,B111,Special Collections,,,,,,,,,,,,,
Johannis Miltoni Samson Agonistes : Graeco carmine redditus cum versione latina,"Milton, John",,,1788,Oxonii,Clarendoniano,"xl,266p.",Contains signature of W Rosemary on second t.p. ,,B152,Special Collections,,,,,,,,,,,,,
Paradise regain'd : a poem in four books,"Milton, John",,,1790,"Printed by W. Young, bookseller, the corner of Second and Chesnut-Street.",#VALUE!,"80 p. From ESTC notes: Bookseller’s advertisement, p. [81-84]. ","Bound in dark brown calfskin . Gilt title over red leather label on spine. Signature of ""Hannah Beck Cross"" on recto of first front endpaper. The name ""Hannah Beck Carols Haskell"" is penciled in beneath it. Name is rewritten on tp. ",,A126,Special Collections,https://worldcat.org/en/title/208192675,N/A,,,,,,,,,,,
Letters on the subject of the proper liberty of the press,s.n.,,,1790,s.n.,#VALUE!,,Bound in marbled paper[?]. ,,B59,Special Collections,,,,,,,,,,,,,
Comus : a mask,"Milton, John; Dalton, John",,,1791,"Printed for the proprietors, under the direction of John Bell, British Library, Strand, Bookseller to His Royal Highness the Prince of Wal",London,"66p. From Cambridge notes: The adaptation by John Dalton, first performed in 1738. - With an additional titlepage, engraved, and an epilogue. - In the imprint of this edition ""British Library"" is hyphenated and both ""Prince"" and ""Wales"" are in capitals. - The Bodleian Library copy is in the original wrappers with the title reading: 'No I. of Bell's British Theatre. Being Comus. ...' - Also issued as part of: 'Bell's British Theatre', 1791-97.",Bound in brown paper with taped spine. ,,A226,Special Collections,https://worldcat.org/en/title/9127138,https://idiscover.lib.cam.ac.uk/permalink/f/t9gok8/44CAM_ALMA71299384730003606,,,,,,,,,,,
Paradise regain'd : a poem in four books,"Milton, John",,,1791,Printed and sold by Henry Taylor,#VALUE!,136p.,Bound in worn dark brown calf . Gilt titling over red leather label on spine. ,,A127,Special Collections,https://worldcat.org/en/title/9518220,N/A,,,,,,,,,,,
"Poems upon several occasions : English, Italian and Latin with translations","Milton, John",,,1791,Printed for G.G.J. and J. Robinson,London,608p.,,,B147,Special Collections,,,,,,,,,,,,,
Cyder : a poem in two books,"Philips, John",,,1791,Printed by George Stafford for T. Cadell,London,183p.,Bound in brown calf. Gilt lettering over red leath label on spine. ,,B248,Special Collections,,,,,,,,,,,,,
Areopagitica : an essay on the liberty of the press.,"Milton, John",,,1791,Printed for J. Deighton,London,68p.,Quarter-bound leather over marbled boards with gilt lettering over goatskin label on spine. ,,B25,Special Collections,,,,,,,,,,,,,
"
Paradise lost : a poem in twelve books","Milton, John; Fenton, Elijah",,,1792,"A. Law, W. Millar and C. Cater",#VALUE!,"299 p. From ESTC: The imprint is false; probably printed at York for Wilson, Spence and Mawman. ’The life of Milton’ is by Elijah Fenton. ",Bound in worn dark brown leather with cracks on spine. ,,A102,Special Collections,,N/A,,,,,,,,,,,
Milton's Paradise lost : illustrated with texts of scripture,"Milton, John",,,1793,"Printed for B. White and Son, T. Longman, B. Law and Son",London,378p. Cambridge notes read: Includes: 'The life of Mr. John Milton' by Elijah Fenton. The final eleven leaves contain 'Allusions to the classics' and the index.,"Vellum cover over paper  boards. Writing on the inside of vellum cover [need to read in detail]. Signatue of Philip Gibbs on recto of front endpaper, faded writing underneath says ""Psalms 3 ver [21]"". Pencilled inscription on final page: ""John 1817"". ",,A315,Special Collections,https://worldcat.org/en/title/1069500580,https://idiscover.lib.cam.ac.uk/permalink/f/t9gok8/44CAM_CON_TRImig10000213774,,,,,,,,,,,
"illustrated with texts of scripture, by John Gillies, D. D. One Of The Ministers In Glasgow.","Milton, John; Fenton, Elijah",,John Gillies,1793,"B. White T. Longman, B. Law and Son, J. Dodsley, J. Johnson, C. Dilly, G. G. J. And J. Robinson, T. Cadell, J. Nichols, R. Baldwin, J. Sewell, J. Murray, T. Hookham, W. Goldsmith, F. And C. Rivington, S. Hayes, W. Lowndes, W. Otridge And Son, C. And T. Wilkie, J. Scatcherd, J. Taylor, E. Jeffery, W. Miller, And E. Newbery.",#VALUE!,378p. From ESTC: The final eleven leaves contain ’Allusions to the classics’ and the index. Includes: ’The life of Mr. John Milton’ by Elijah Fenton. ,"Bound in brown speckled calf with gilt rulings on spine. Gilt titling over red label on spine. Bookplate of Laur. Dinnriddie on front pastedown.Recto of front endpaper has note: ""From the sale at Milton Loch L[?] in August 1957 R.H.F""",,A103,Special Collections,https://worldcat.org/en/title/13280067,N/A,,,,,,,,,,,
Milton's Paradise lost. [ONCE AGAIN CATALOGUE LISTS AS ONE VOLUME; NEED TO REVIEW COPIES AGAIN] ,"Milton, John",,,1795,,,2 volumes. ,Both volumes bound in speckled brown calf with gilt rulings on coverwith decorative gilt tooling and gilt lettering on spine. Marbled pastedowns. Bookplate of Chase Robert Marshall on front pastedowns of both volumes. Inscription on recto of both second front endpapers: Anne Elizabeth Fooks July 14th 1824.,,B113,Special Collections,,,,,,,,,,,,,
Select poems.,s.n.,,,1795,s.n.,England,"Half Bound black leatther over marbled boards. Inscription on recto of front endpaper ""Mary Young, The gift of John Hatrele[?] Esq."" Signature of Hatrele on tp.. ",,,B185,Special Collections,,,,,,,,,,,,,
Il Paradiso perduto di Giovanni Milton : tradotto in verso italiano,"Milton, John; Mariottini, Felice",,,1796,Presso G. Polidori,Londra,"209, 208p. Cambridge copy lists page number as 208p. ",Half bound black leather over marbled boards,,B127,Special Collections,https://worldcat.org/en/title/1069347210,https://idiscover.lib.cam.ac.uk/permalink/f/t9gok8/44CAM_ALMA21424597640003606,N/A,,,,,,,,,,
"
Paradise lost : a poem in twelve books","Milton, John",,,1796,Printed by William Magee,#VALUE!,328 p.,"quarter Bound brown calf over darker brown mottled calf. Gilt titling over red leather label on spine. Signature on right upper corner of recto of front endpaper: ""M k Gwynn April 1918"". TP contains several inscriptions , including name ""John Gwynn"" dated ""Jan 1888"". Other scribblings are illegible/faded.",,A104,Special Collections,https://worldcat.org/en/title/19418699,N/A,,,,,,,,,,,
The poetical works of John Milton : from the text of Dr. Newton. [NEED TO REVIEW COPY - SIMILAR EDITIONS IN WORLDCAT POINT TO THE COOKE PRINTING IN LONDON; NO ESTC ENTRY],"Milton, John",,,1796,Printed by Joseph Bumstead,Boston,373p.,"Bound in brown mottled calf. Gilt titling and tooling on spine. Pencilled noted on front pastedown reads ""Mary ann brought this from 'Nillo[?]' & gave it to me as a souveneir of the Ch family. July 1870 Chatterton[?] family. July 1870 Eliza"". Faint inscription on verso of final back endpaper ""Ellen E"". ",,A135,Special Collections,https://worldcat.org/en/title/1069351925,N/A,,,,,,,,,,,
The poetical preceptor : or a collection of select pieces of poetry extracted from the works of the most eminent English poets.,various authors,,,1796,Printed only for S. Crowder,#VALUE!,380p.,Quarter leather over marbled boards . Gilt rulings on spine. Gilt lettering over green goatskin label on spine. Faded inscriptions throughout first three pages. Ink drawing of a bird with the name J Shaw in the middle opposite t.p. NEED TO RETURN TO! ,,A156,Special Collections,https://worldcat.org/en/title/1069365584,N/A,,,,,,,,,,,
Paradise lost,"Milton, John",,,1796,Printed for J. Parsons.,London,"2 volumes. UWO Catalogue lists publisher as T. Parsons, where ESTC lists as J. Parsons. ESTC notes: The titlepages are engraved. With a list of subscribers in vol.1.",Both volumes bound in red goatskin with gilt rulings on covers and gilt lettering on spine. Marbled pastedowns and gilt foredges. ,,B114,Special Collections,https://worldcat.org/en/title/1069350761,N/A,No,,,,,,,,,,
"Comus, a mask : presented at Ludlow Castle 1634, before the Earl of Bridgewater, then President of Wales","Milton, John",,,1798,"Printed by and for W. Bristow on the Parade; for Messrs. Rivingtons, St. Paul's Church-yard, and W. Clarke New Bond-street, London; Messrs. Fletcher and Co., Oxford, and J. Deighton, Cambridge",Canterbury,"xxi, 199 p. ; 23 cm.",Half-bound brown calf over marbled boards with raised bands and gilt lettering on spines. Marbled pastedowns.,,B225,Special Collections,,,,,,,,,,,,,
"
The beauties of the poets : being a collection of moral and sacred poetry from the most eminent authors","Janes, Thomas",,,1799,Printed by and for Darton and Harvey,#VALUE!,280p.,"Bound in brown speckled leather with decorative gilt rulings on coverl. Gilded bands, and gilt lettering over red leather label on spine. ",,A195,Special Collections,https://worldcat.org/en/title/1071813517,N/A,,,,,,,,,,,
"Considerations of Milton's early readings and the prima stamina of his Paradise Lost : together with extracts from a poet of the sixteenth century : in a letter to William Falconer, M.D. from Charles Dunster, M.A.","Dunster, Charles",,,1800,Printed by and for John Nichols,London,249p.,Bound in green cloth.,,B17,Special Collections,,,,,,,,,,,,,
Paradise lost : a poem in twelve books,"Milton, John",,,1801,"J. Johnson, et al",#VALUE!,"356 p. ""Printed from the text of Tonson's correct edition of 1711.""--t.p.",Bound in uncut green leather with gilt rulings and titling on spine,,A105,Special Collections,https://worldcat.org/en/title/977982245,N/A,,,,,,,,,,,
The poetical works of John Milton : from the text of Dr. Newton : with critical essay by J. Aiken.,"Milton, John",,,1801,"Printed for J. Johnson, et al",London,4 volumes.,"Bound in tanned speckled calf with decorative gilt tooling on cover. Decorative gilt tooling on spine and marbled pastedowns. Missing red leather label has been placed on tp. Marbled foredges . Inscription on top of t.p. ""Fanny Fellowes April 1811. the gift of E. Mitford. All Four volumes contain the signature of Fanny Fellowes, only vol. 1 mentions E. Mitford. ",,A209,Special Collections,,,,,,,,,,,,,
Milton's Paradise lost.,"Milton, John",,,1802,Printed by T. Bensley,London,2 vols. ,"Bound black goatskin with decorative gilt tooling and rulings on cover. Gilt tooling, gilt lettering, and raised bands on spine. Gilt foredges and marbled pastedown. ",,B303,Special Collections,,,,,,,,,,,,,
"
Paradise regain'd : Comus, a mask : L'Allegro, and Il Penseroso","Milton, John",,,1805,W. Suttaby,London,95p. Worldcat only lists one other copy. Could be very rare. ,"Bound in brown marbled calf, decorative gilt tooling, and gilt lettering over red morocco on spine. Initials ""A.M.A"" inscribed on recto of front endpaper. ",,A206,Special Collections,https://worldcat.org/en/title/24101409,N/A,,,,,,,,,,,
Paradis perdu,"Milton, John",,,1805,Chez Giguet et Michaud,#VALUE!,3 volumes,Bound in light brown diced clf with gilt tooled trim and red marbled foredges and pastedowns. Gilt titling on spine. All volumes signed on tp by [?] Hutchinson.,,A111,Special Collections,3889334,,,,,,,,,,,,
Paradis perdu,"Milton, John; Delille, Jacques",,,1805,Chez Giguet et Michaud,Paris,3 vols. ,Bound in speckled calf with decorative gilt tooling on cover. Decorative gilt tooling and gilt lettering over leather label(s) of spine. ,,B297,Special Collections,,,,,,,,,,,,,
The poetical works of John Milton,"Milton, John",,,1805,Printed at the Stanhope Press by Charles Whittingham,London,2 volumes,"Bound in green goatskin with decorative blind tooling and decorative gilt rulings on cover. Gilt tooling and gilt lettering on spine and gilt foredges. Inscription on first front pastedown: ""L Burlington from aunt Warre"" Vol 2. just has ""Burlington"" ",,,Special Collections,,,,,,,,,,,,,
"
Paradise lost : a poem in twelve books","Milton, John; Cooke, H.R.",,,1807,Printed for Thomas Tegg,London,284p.,"Bound in marbled brown calf with gilded bands on spine. Name inscribed in pencil on front pastedown"" Stendhall"". ",,A200,Special Collections,https://worldcat.org/en/title/489663457,N/A,,,,,,,,,,,
The poetical works of John Milton : to which is prefixed the life of the author.,"Milton, John",,,1808,"Printed for J. Walker, et al",London,551p.,"Bound in brown marbled calf. Decorative gilt tooling on spine and gilt title over red morocco label. Gilt notches on binding edge. Drawinng/inscription on recto of first front endpaper; illegible, but dated 1811. ",,A138,Special Collections,https://worldcat.org/en/title/5114700,N/A,,,,,,,,,,,
The poetical works of John Milton,"Milton, John",,,1808,"J. Johnson, et al",London,4 volumes.,"Bound in brown mottled calf, decorative gilt tooling and lettering over black label on spine. Signatures  of Emma Maria Wild and Rob Pratt of Cabra castle in all four volumes.",,A240,Special Collections,https://worldcat.org/en/title/1071736188,N/A,N/A,,,,,,,,,,
The prose works of John Milton : containing his principal and ecclesiastical pieces : with new translations and an introduction,"Milton, John",,,1809,Printed for John Miller,London,2 volumes,"Bound in brown leather withh gilt rulings on cover. Decorative gilt tooling and gilt lettering over leather labels on spine. Both volumes contain bookplate of ""Chr Parker Warner"". Vol. 1 contains bookseller ticket of John Britnell. ",,B260,Special Collections,,,,,,,,,,,,,
The poetical works of John Milton : with his life,"Mlton, John; [Mitford, John]?",,,1810,John Sharpe,London,3 volumes.,"Half-bound brown calf over green cloth with gilt letter over black leather label on spine. Inscription on recto of first front endpaper: "" Agnes Grant Grierson (b.171) is my great grandmother died 1847 [illegible]."" H.J.C Grierson pencilled in top right corner of same page. All three volumes have the same bindings, but there is only an inscription on volume 1. ",,A232,Special Collections,https://worldcat.org/en/title/643576831,N/A,N/A,,,,,,,,,,
Paraiso perdido : poema de Milton : traducido en verso Castellana,"Milton, John; Escoiquiz, Juan",,,1812,Gilles,Bourges,3 vols. Cambridge notes: With half-titles; that for v. 1 has full-page list of distributors on verso.Plates are frontispieces. Errata: at end of each volume. With translator's preface.,"Half-bound brown calf over marbled boards, with marbled pastedowns and foredges. Gilt rulings, raised bands, and gilt lettering on spine. Inscription on recto of second front endpaper of vol 1: ""Wm. P. Knapp from his brother [?] Sept 20th. 1859""; Vols. 2 and 3 have inscriptions in same place ""William P. Knapp New York 1859"". All 3 vols contain bookplate of William P Knapp with  catalogue numbers of 240-242. Vol 1 has note written in italian on recto of second back endpaper.",,B129,Special Collections,https://worldcat.org/en/title/1071805133,https://idiscover.lib.cam.ac.uk/permalink/f/t9gok8/44CAM_ALMA21472373310003606,N/A,,,,,,,,,,
"The state of innocence and the fall of man described in Milton's Paradise lost : rendered into prose with historical, philosophical, and explanatory notes : from the French of the learned R. de St. Maur","Milton, John",,,1813,Published by William Robinson and John C. Moore,Trenton,450p.,Marbled boards with taped spine. Original leather binding removed. Bookplate of Library Company of Philadelphia on front pastedown. ,,B301,Special Collections,,,,,,,,,,,,,
"Det förlorade paradiset / poem i tolf sånger, af Milton ; öfversättning af J. G. Oxenstierna.","Milton, John",,,1815,Carl Delén,Stockholm,452p.,Quarterbound Brown goatskin over brown boards with gilt lettering on spine. ,,B130,Special Collections,https://worldcat.org/en/title/1069333166,https://idiscover.lib.cam.ac.uk/permalink/f/t9gok8/44CAM_ALMA21476441710003606,N/A,,,,,,,,,,
"
Paradise lost : a poem in twelve books","Milton, John",,,1815,"Published by Suttaby, Evance & Fox",London,305p.,"Bound with A220a. Bound in brown leather with ornamental gilt ruling on cover. Decorative Blind tooling  on spine, with gilt lettering over brown label. Marbled pastedowns and foredges. ",,A220,Special Collections,https://worldcat.org/en/title/15554811,N/A,,,,,,,,,,,
Comus : a mask : altered from Milton : correctly given from copies used in the theatres,"Milton, John",,,1815,Chiswick Press by C. Whittingham,London,24p.,Bound in paper with taped spine. Two copies. ,,A228,Special Collections,https://worldcat.org/en/title/1066811003,N/A,,,,,,,,,,,
"Milton's Comus : a masque in two acts as revived at the Theatre-Royal, Covent Garden, Friday, April 28, 1815.","Milton, John",,,1815,Printed for John Miller,London,29p.,Bound by paper cover with taped spine. Title written in pencil on first page. ,,B278,Special Collections,,,,,,,,,,,,,
Det Forlorade paradiset : poem i tolf sanger af Milton.,"Milton, John",,,1815,Carl Delén,Stockholm,452p.,"Half-bound green goatskin over darker green goatskin. Gilt rulings on cover. Raised bands, gilt tooling and gilt lettering on spine. Inscription on recto of first front endpaper "" [?] Euphrosyne Berg [b]ill Stensimmonsson Yulen 1910"" ",,,Special Collections,,,,,,,,,,,,,
Paradise lost.,"Milton, John",,,1816,Printed for John Sharpe,London,382p.,Bound in red cloth with paper label on spine. ,,B115,Special Collections,https://worldcat.org/en/title/16528506,https://idiscover.lib.cam.ac.uk/permalink/f/t9gok8/44CAM_ALMA21415211650003606,N/A,,,,,,,,,,
Paradise regained : etc.,"Milton, John",,,1816,Printed for John Sharpe,London,432p.,Bound in red cloth with paper label on spine. ,,B115a,Special Collections,https://worldcat.org/en/title/1069311336,https://idiscover.lib.cam.ac.uk/permalink/f/t9gok8/44CAM_ALMA21425291160003606,N/A,,,,,,,,,,
Paradise lost.,"Milton, John",,,1816,Printed for John Sharpe,London,unpaginated,"Bound in burgundy goatskin with decorative gilt rulings on cover. Decorative gilt tooling, raised bands, and gilt lettering on spine.",,B259,Special Collections,,,,,,,,,,,,,
Poems on several occasions,"Milton, John",,,1817,John Sharpe,London,188p. Title on flyleaf: The minor poems of John Milton.,"Bound in brown calf wil gilt rulings on cover. Decorative gilt tooling and lettering on spine. Marbled pastedowns and foredges. ""Grant"" Bookplate on front pastedown.",,A245,Special Collections,https://worldcat.org/en/title/341338716,N/A,N/A,,,,,,,,,,
Paradise lost : a poem in twelve books,"Milton, John",,,1817,John Sharpe,London,"2v. Unclear why this is listed as 245a; by all accounts it is a different text. [NEED TO REVIEW COPY]; Added engraved title-pages dated 1816. Each illustration is on a separate plate at the start of each Book. ""Drawn by Richard Westall, R.A. Engraved by Charles Heath. Published by John Sharpe, Piccadilly: Aug. 24, 1816.""","Bound in brown calf wil gilt rulings on cover. Decorative gilt tooling and lettering on spine. Marbled pastedowns and foredges. ""Grant"" Bookplate on front pastedown.",,A245a,Special Collections,https://worldcat.org/en/title/10201167,N/A,N/A,,,,,,,,,,
"Paradise regained, Samson Agonistes, Comus, and Arcades","Milton, John",,,1817,John Sharpe,London,various pagings.,"Bound in brown calf wil gilt rulings on cover. Decorative gilt tooling and lettering on spine. Marbled pastedowns and foredges. ""Grant"" Bookplate on front pastedown.",,A245b,Special Collections,https://worldcat.org/en/title/941447213,N/A,N/A,,,,,,,,,,
Paradise lost : a poem in twelve books,"Milton, John",,"Westall, Richard; Heath, Charles",1817,Printed for John Sharpe,London,2 volumes,Both volumes bound in pink calf with gilt lettering over red leather label on spine. ,,B229,Special Collections,,,,,,,,,,,,,
The history of Britain : that part especially now called England : from the first traditional beginning continued to the Norman Conquest collected out of the ancientest and best authors thereof,"Milton, John",,,1818,Printed for R. Wilks,London,"xliii, 400 p.",Bound in brown cloth binding . ,,B85,Special Collections,,,,,,,,,,,,,
Coll gwynfa : cyfieithiad gan Idrison,"Milton, John",,,1819,W. Marchant,Llundain,371p.,Bound in brown paper with taped spine and paper label. ,,B131,Special Collections,https://worldcat.org/en/title/26446741,https://idiscover.lib.cam.ac.uk/permalink/f/t9gok8/44CAM_ALMA21481992090003606,N/A,,,,,,,,,,
Paradise lost : a poem in twelve books,"Milton, John;",,,1821,Printed for John Sharpe,London,"unpaginated. From Cambridge notes: Unpaginated with line numbers only at head of each page. Engraved half-title has date of 1822. Also separate engraved part-title to each book, by Richard Westall. The life of John Milton / by Elijah Fenton.","Bound in brown leather with decorative gilt tooling and rulings bordering blind tooling and rulings on cover. Decorative gilt tooling, raised bandsm and gilt lettering on spine. Marbled pastdowns and foredges. Bookplate of Joseph William Thrupp on front pastedown. Signature of Joseph William Thrupp written twice on recto of first front endpaper, first time (pencil) is dated July 27th 1822, the second (ink) is dated July 27th 1824. ",,A201,Special Collections,https://worldcat.org/en/title/13289139,N/A,,,,,,,,,,,
Paradise lost : in twelve books : with other poems,"Milton, John",,,1821,Printed for John Bumpus,London,300p.  ,"Bound in green leather with decorative gilt tooling and ruling on cover. Decorative gilt tooling, raised bands, and gilt lettering spine. Gilt Foredge drawing of a scene that surely must be somewhere in London. ",,A202,Special Collections,https://worldcat.org/en/title/54666332,N/A,,,,,,,,,,,
