Title,Author(s),Editor(s),Illustrator(s),Publication Date,Publisher,Publishing Location,General Notes,Copy Specific Notes,G. William Stuart Donation Statement,Call Number,Location,WorldCat,Cambridge,UWO Copy in ESTC,,,,,,,,,,
La seconde semaine,"Du Bartas, Guillaume de Salluste",,,1591,Par Perre Roussin,Nevers,"115p. [Need to review]. Second semaine was the title of Du Barta's greater work which includes ""La Furies"" , the first part of this text. Cambridge notes: His Majesty = James I. In verse. Head-pieces; decorative initials. Stationer's Register: entered to R. Field 7 August 1589. Publication date from STC and internal title page. The first work, ""The Furies"", is a translation of Guillaume de Saluste Du Bartas's ""Les Furies"", included in ""La Seconde Semaine"" (1584). ""The Lepanto of Iames the sixt, King of Scotland"" and ""La Lepanthe de Iaques VI. Roy d'Escosse, faicte francoise par le Sieur Du Bartas"" each have separate title page; register is continuous.",Bound in vellum. Inscription first front endpaper: Ex Dono Dni Claudis Durce 16 Novemb 1591 Dura ct Quiosoe. ,,B294,Special Collections,https://worldcat.org/en/title/1066849749,,Yes,,,,,,,,,,
The teares or lamentations of a sorrowfull soule,"Leighton, William",,,1613,Printed by Ralph Blower,London,189p. ,"Bound in light brown calf with blind tooling on cover. Raised bands, decorative blind tooling, and gilt lettering on spine. Marbled pastedowns. Bookplate of James Bindley on front pastedown.  Bookplate of Francis Freeling on recto of first front endpaper. ",,B284,Special Collections,https://worldcat.org/en/title/43000334,https://idiscover.lib.cam.ac.uk/permalink/f/t9gok8/44CAM_ALMA21391057760003606,No,,,,,,,,,,
Du Bartas : his devine weekes and workes translated and dedicated to the Kings most excellent Maiestie,"Du Bartas, Guillaume de Salluste",,,1613,Humphrey Lownes,London,"819p. Cambridge notes: In verse. The title page is engraved and signed: W Hole sculp: Bookseller's name and address from colophon, which has ""1613."" at head. ""The historie of Iudith"", translated by Thomas Hudson, has separate dated title page and pagination; register is continuous. Includes translations of ""Quatrains"" by Guy du Faur seigneur de Pibrac and ""Paradoxe que les adversitez sont plus necessaires que les prosperités"" by Odet de La Noue seigneur de Téligny. Includes index.","Bookplate on front pastedown with the Initials TS, signed Byrd Beverley, bookplate on recto of first front endppaper of Mr George Watson Neish. Contains sale description. ",,B293,Special Collections,https://worldcat.org/en/title/1069354076,https://idiscover.lib.cam.ac.uk/permalink/f/t9gok8/44CAM_CON_GIR5GC0001654,No,,,,,,,,,,
L'Adamo sacra rapresentatione,"Andreini, Giovanni Battista",,,1617,Geronimo Bordoni,#VALUE!,177p. Cambridge notes read: Illustrations engraved by C. Bassano after C.A. Procaccini. (WorldCat) Title page is engraved. With a frontispiece portrait (plate),"Bound in brown goatskin with blind ruling on cover. Raised bands, blind tooling, and gilt lettering on spine. Bookplates of HG Plimmer and D Bernard on front pastedown. Marbled pastedowns and gilt foredges. Bookplate with initials DR on verso of front endpaper. ",,B1,Special Collections,https://worldcat.org/en/title/1069296811,https://idiscover.lib.cam.ac.uk/permalink/f/t9gok8/44CAM_CON_TRImig10000208511,N/A,,,,,,,,,,
Ode on the morning of Christ's nativity [Need to review],"Milton, John",,,1629,,,,"Bound in white leather with deocrative gilt tooling on cover, gilt lettering and raised bands on spine. Name on front pastedown: ""Katharine Adams binding dated 1899"" ",,A259,Special Collections,,,,,,,,,,,,,
Flores sive phrasium poeticarum thesaurus absolutissimus,"Buchler, Johann",,,1631,Bernardi Gualtheri,Coloniae,832 p.,Bound in vellum,,A178,Special Collections,https://worldcat.org/en/title/1069269579,N/A,,,,,,,,,,,
"A maske presented at Ludlow Castle, 1634: on Michaelmasse night, before the Right Honorable Iohn Earle of Bridgewater, Vicount Brackly Lord President of Wales, and one of His Maiesties most honorable Privie counsell.","Milton, John",,,1637,"Printed for Hvmphrey Robinson, at the signe of the Three pidgeons in Pauls church yard",#VALUE!,"35 p. 25 cm. Facsimile copy of the 1st ed. of 'Comus'; issued as a supplement in vol. 1, 1902 of the 'Bibliographer'.",,No,PR3557.A1 1637 1902,Special Collections,https://ocul-uwo.primo.exlibrisgroup.com/permalink/01OCUL_UWO/r0c2m8/alma991026136129705163,,,,,,,,,,,,
Virgilii evangelisantis christiados libri XIII.,"Ross, Alexander",,,1638,,#VALUE!,"311p. There are THREE variant editions of this text [NEED TO RECHECK FOR VARIANT] From ESTC notes: 	A history of Jesus Christ, and of prophecies of his Messiahship, in Virgilian verse. A greatly revised and enlarged edition of: Virgilius evangelisans. With additional engraved title page (plate), signed ""Will: Marshall sculpsit 1638"", and with imprint: Londini. Pro Richardo Thralo, apud quem væneunt in vico vocato Cheap-side.",Bound in brown calf with blind tooling on cover and spine. Gilt lettering over burgundy leather label on spine. ,,A157,Special Collections,https://worldcat.org/en/title/1069272252,https://idiscover.lib.cam.ac.uk/permalink/f/t9gok8/44CAM_ALMA21415598240003606,,,,,,,,,,,
"Justa Edovardo King naufrago ab amicis moerentibus, amoris ....","Milton, John; King, Henry",,,1638,Apud Thomam Buch & Rogerum Daniel,#VALUE!,"36 p. From Cambridge notes: A collection of elegiac verse in English, Latin and Greek by a number of writers including Henry King, and the first appearance in print of John Milton's 'Lycidas'. In two parts. Second part has its own full title page; title framed with three heavy black mourning borders: ""Obsequies to the memorie of Mr Edward King, anno dom. 1638. ..."" Pagination is separate; register continuous. Last two words of title transliterated from the Greek. Text in English, Latin and Greek.",Bound in light brown speckled calf with gilt lettering on spine.,,A197,Special Collections,https://worldcat.org/en/title/1069350104,https://idiscover.lib.cam.ac.uk/permalink/f/t9gok8/44CAM_CON_TRImig10000205569,,,,,,,,,,,
Obsequies to the memorie of Mr. Edward King /[John Milton].,"Milton, John; King, Henry",,,1638,Printed by Th. Buck and R. Daniel,#VALUE!,"25p. Contained in Justa Edovardo King naufrago, ab Amicis moerentibus, amoris. Cambridge General Notes: ""A collection of elegiac verse in English, Latin and Greek by a number of writers including Henry King, and the first appearance in print of John Milton's 'Lycidas'. In two parts. Second part has its own full title page; title framed with three heavy black mourning borders: ""Obsequies to the memorie of Mr Edward King, anno dom. 1638. ..."" Pagination is separate; register continuous. Last two words of title transliterated from the Greek.Text in English, Latin and Greek.""",Bound in mottled dark brown calf with gilt title on spine [Lycidas - Milton -1638],Yes,A197a,Special Collections,http://www.worldcat.org/oclc/1066819086,https://idiscover.lib.cam.ac.uk/permalink/f/t9gok8/44CAM_CON_TRImig10000205569,,,,,,,,,,,
Episcopacie by divine right,"Hall, Joseph",,,1640,Printed by Richard Badger for Nathaniel Butter,#VALUE!,262p.,"Bound in brown speckled calf with title written on paper label on spine. ""Janet Fleming"" inscribed on recto of first front endpaper. ",,B217,Special Collections,https://worldcat.org/en/title/1066854111,https://idiscover.lib.cam.ac.uk/permalink/f/t9gok8/44CAM_ALMA21459038990003606,,,,,,,,,,,
An humble remonstrance to the High Court of Parliament,"Hall, Joseph",,,1640,,,43p.,Bound in speckled brown calf with blind rulings on cover and raised bands on spine. Bound with B30 - B36. Bookplate of Watkin Williams Esqr of Penbedn in the Country of Denbigh on front pastedown. List of contents written by hand on verso of front endpaper. Inscription on tp. of Rlostyn of Xt chuch of Oxon. ,,B29,Special Collections,,,,,,,,,,,,,
An humble remonstrance to the High Court of Parliament,"Hall, Joseph",,,1640,,,43p.,Bound with B38 - B42. Bound in speckled calf with blind tooled rulings and raised bands on spine.  Bookplate of Watkin Williams Esqr of Penbedn in the Country of Denbigh on front pastedown. List of contents on front pastedown. ,,B37,Special Collections,,,,,,,,,,,,,
"A defence of the Humble remonstrance against the frivolous and false exceptions of Smectymnuus [pseud.], wherein the right of leiturgie and episcopacie is clearly vindicated from the vaine cavils, and challenges of the answerers","Hall, Joseph",,,1641,N. Butler,#VALUE!,"168, [12] p. 19 x 14 cm.",Also contains Barnett statement; need to check copy. ,Yes,BX5132.H17,Special Collections,http://www.worldcat.org/oclc/1066779392,https://idiscover.lib.cam.ac.uk/permalink/f/t9gok8/44CAM_ALMA21298290950003606,,,,,,,,,,,
The reason of Church-governement urg'd against prelaty,"Milton, John",,,1641,Printed by E.G. for Iohn Rothwell,#VALUE!,"65p. The first of Milton's works written in support of the five Protestant ministers in the Smectymnuus controversy. (Cambridge)
Smectymnuus: pseudonymn for Stephen Marshall, Edmund Calamy, Thomas Young, Matthew Newcomen and William Spurstow."" (Cambridge) First edition, two books. Wickenheiser notes that this book is rare.","Brown half-calfskin with gilt ruling on edges and marbled boards, pastedowns, and endpapers. Contains purchase slip as well as postcard from Heritage Book Shop, Hollywood, California. The postcard is addressed to James J. Talmen, former Chief Librarian at UWO. Note on recto of second front endpaper: ""First edition. 1641 / Printer's [design?] on title page [Mckerrow 420(A) head margin of title repaid some cropping/ Wing M. 2175"" and in a different hand: ""catchword touched in [2] a few instances""",Yes,B262,Special Collections,http://www.worldcat.org/oclc/977195357,https://idiscover.lib.cam.ac.uk/permalink/f/t9gok8/44CAM_ALMA21418327430003606,No,,,,,,,,,,
Of reformation touching church-discipline in England : and the causes that hitherto have hindred it : two books written to a friend,"Milton, John",,,1641,Printed for Thomas Underhill,#VALUE!,90p. First edition. First acknowldged prose work by Milton. Does not contain rare errata leaf noted by Wickenheiser. ,Bound in red morroco with gilt title and raised bands on spine. Decorative tooling on edges of inner boards and gilt foredges. Binder's ticket on end pastdown. ,Yes ,B89,Special Collections,http://www.worldcat.org/oclc/1069326152,https://idiscover.lib.cam.ac.uk/permalink/f/t9gok8/44CAM_ALMA71358270160003606,,,,,,,,,,,
Animadversions upon the remonstrants defence against Smectymnuus.,"Milton, John",,,1641,Printed for Thomas Underhill,#VALUE!,,,Yes,B34,Special Collections,http://www.worldcat.org/oclc/64062279,https://idiscover.lib.cam.ac.uk/permalink/f/t9gok8/44CAM_CON_TRImig10000147340,,,,,,,,,,,
A discourse shewing in what state the three kingdomes are in at present.,"Milton, John*",,,1641,s.n.,s.l.,6p. Authorship uncertain. Sometimes attributed to John Milton. ,Bound in quarter red leather over red cloth with gilt titling on spine. ,Yes,B161,Special Collections,http://www.worldcat.org/oclc/913389440,https://idiscover.lib.cam.ac.uk/permalink/f/t9gok8/44CAM_CON_TRImig10000194797,,,,,,,,,,,
The reason of Church-governement urg'd against prelaty,"Milton, John",,,1641,Printed by E.G. for Iohn Rothwell,#VALUE!,"65p. The first of Milton's works written in support of the five Protestant ministers in the Smectymnuus controversy. (Cambridge)
Smectymnuus: pseudonymn for Stephen Marshall, Edmund Calamy, Thomas Young, Matthew Newcomen and William Spurstow."" (Cambridge) First edition, two books. Wickenheiser notes that this book is rare.",Half-bound brown goatskin over marbled boards. Bookplate of Frank W. Gunsaulus on front pastedown. ,,B262,Special Collections,,,,,,,,,,,,,
Of prelatical episcopacy : and whether t may be deduc'd from the apostolical times by vertue of those testimonies which are alledg'd to that purpose in some late treatises : one whereof goes under the name of Iames Archbishop of Armagh. ,"Milton, John",,,1641,Printed by R.O. & G.D. for Thomas Underhill,#VALUE!,"24p. From ESTC: [1st ed.].Anonymous, by John Milton. A reply to James Ussher's The judgement of Doctor Rainoldes touching the originall of episcopacy. The second of Milton's pamphlets written in support of the five Protestant ministers in the Smectymnuus controversy.","Contains purchase slips from 1970. Bound in dark green goatskin with gilt title on spine and two raised bands, gilted ruling on inner cover. Notes on recto of first front endpaper ""Parker 54 (p850)/ A1 (blank) wanting/ 1st 8 pages unnumbered (some copies are) "" ",Yes ,B263,Special Collections,http://www.worldcat.org/oclc/1071212522,,,,,,,,,,,,
Of prelatical episcopacy : and whether t may be deduc'd from the apostolical times by vertue of those testimonies which are alledg'd to that purpose in some late treatises : one whereof goes under the name of Iames Archbishop of Armagh.,"Miltin, John",,,1641,Printed by R.O. & G.D. for Thomas Underhill,#VALUE!,24p.,Bound in green goatskin with gilt lettering on spine. ,,B263,Special Collections,,,,,,,,,,,,,
A defence of the humble remonstrance against the frivolous and false expectations of Smectymnuus : wherein the right of leiturgie and episcopacie is clearly vindicated from the vaine cavils and challenges of the answerers,"Hall, Joseph",,,1641,Printed for Nathaniel Butter,#VALUE!,168p.,Quarter-bound goatskin over green cloth boards with gilt lettering on spine.,,B28,Special Collections,,,,,,,,,,,,,
Of reformation touching church-discipline in England : and the causes that hitherto have hindred it : two books written to a freind.,"Milton, John",,,1641,Printed for Thomas Underhill,#VALUE!,90p.,Bound in burgundy morocco riviere binding with gilt lettering on spine and dentelles on inner covers. Contained in Quarterbound burgundy goatskin over mustard cloth slipcase. ,,B89,Special Collections,,,,,,,,,,,,,
A discourse shewing in what state the three kingdomes are in at present.,"Milton, John",,,1641,s.n.,s.l.,[6]p. Cambridge notes: Formerly attributed to John Milton,,,B161,Special Collections,https://worldcat.org/en/title/913389440,https://idiscover.lib.cam.ac.uk/permalink/f/t9gok8/44CAM_ALMA21472394000003606,,,,,,,,,,,
"Tyrannicall-government anatomized : or, a discourse concerning evil-councellors : being the life and death of John the Baptist and presented to the Kings most excellent majesty by the author.","Buchanan, George",,,1642,Printed for John Field,#VALUE!,"28p. ""By George Buchanan. This is an anomymous translation of his Baptistes, first published 1577. The translation has been ascribed to John Milton."" (Cambridge)",Bound in quarter green leather over green cloth with gilt title on spine. ,Yes,B207,Special Collections,http://www.worldcat.org/oclc/1105298746,https://idiscover.lib.cam.ac.uk/permalink/f/t9gok8/44CAM_ALMA21381478360003606,,,,,,,,,,,
A reply to the answer printed by his majesties command at Oxford to a printed booke intituled Observations upon some of his maiesties late answers and expresses,"Milton, John*",,,1642,Printed for Matthew Walbancke,#VALUE!,Attributed to John Milton. ,Bound in brown calf. ,Yes,B163,Special Collections,http://www.worldcat.org/oclc/960103634,https://idiscover.lib.cam.ac.uk/permalink/f/t9gok8/44CAM_ALMA21491114250003606,,,,,,,,,,,
An apology against a pamphlet call'd A Modest Confutation of the animadversions upon the remonstrants against Smectymnuus.,"Milton, John",,,1642,Printed by E.G. for Iohn Rothwell,#VALUE!,"""This is the fifth of Milton's pamphlets written in support of the five Protestant ministers in the Smectymnuus controversy. Smectymnuus is a pseudonymn composed of the initials of the authors who used it, viz. Stephen Marshall, Edmund Calamy, Thomas Young, Matthew Newcomen, and William Spurstowe."" (Cambridge)",Bound with: B29.,Yes,B35,Special Collections,http://www.worldcat.org/oclc/1066829903,https://idiscover.lib.cam.ac.uk/permalink/f/t9gok8/44CAM_CON_TRImig10000144066,,,,,,,,,,,
"New from Hell, Rome and the innes of court : wherein is set forth the coppy of a letter written from the Devill to the Pope, the true coppy of the petition delivered to the King at Yorke, the coppy of certaine articles of agreement betweene the Devill, the Pope, and divers others ... : published for the future peace and tranquility of the inhabitants of Great Britany","Milton, John",,,1642,s.n.,#VALUE!,,"Burgundy Half-Calf with gilt ruling on marbled boards, gilted title and tooling on spine, gilt foredges. Page numbers added by hand. ",Yes,B162,Special Collections,http://www.worldcat.org/oclc/1069312005,N/A,,,,,,,,,,,
"New from Hell, Rome and the innes of court : wherein is set forth the coppy of a letter written from the Devill to the Pope, the true coppy of the petition delivered to the King at Yorke, the coppy of certaine articles of agreement betweene the Devill, the Pope, and divers others ... : published for the future peace and tranquility of the inhabitants of Great Britany","Milton, John",,,1642,s.n.,England,26p.,Anthony Fair pasted in on front pastedown,,B162,Special Collections,https://worldcat.org/en/title/1069312005,N/A,No,,,,,,,,,,
A reply to the answer printed by his majesties command at Oxford to a printed booke intituled Observations upon some of his maiesties late answers and expresses,"Milton, John",,,1642,Printed for Matthew Walnacke,London,46p.,,,B163,Special Collections,https://worldcat.org/en/title/960103634,https://idiscover.lib.cam.ac.uk/permalink/f/t9gok8/44CAM_ALMA21491114250003606,,,,,,,,,,,
The doctrine and discipline of divorce restor'd to the good of both sexes from the bondage of canon law and other mistakes to Christian freedom guided by the rule of charity : wherein also many places of scripture have recover'd their long-lost meaning.,"Milton, John",,,1643,Printed by T.P and M.S.,#VALUE!,"48p. ""According to Shawcross, the printers are Thomas Payne and Matthew Simmons, and the work dated late July or August.""(Cambridge) First Edition.",Bound in navy quarter calf over cloth with gilt title on spine.,Yes,B74,Special Collections,http://www.worldcat.org/oclc/1032031996,https://idiscover.lib.cam.ac.uk/permalink/f/t9gok8/44CAM_ALMA21297547770003606,,,,,,,,,,,
"The noble-mans patterne of true and reall thankfulnesse : presented in a sermon preached before the Right Honourable House of Lords at their late solemne day of thanksgiving, June 15, 1643","Calamy, Edmund",,,1643,Printed by G.M. for Christopher Meredith,#VALUE!,"59p. ESTC Notes read: With an order to print on verso of first leaf. Running title reads: A thanks-giving sermon preached before the Right Honourable the House of Lords.  Identified as Wing C260 on UMI microfilm set ""Early English books, 1641-1700"", reel 760.",Quarterbound blue goatskin over marbled boards with gilt lettering on spine.,,B10,Special Collections,https://worldcat.org/en/title/23638711,https://idiscover.lib.cam.ac.uk/permalink/f/t9gok8/44CAM_ALMA71464882970003606,,,,,,,,,,,
The doctrine & discipline of divorce : restor'd to the good of both sexes from the bondage of canon law and other mistakes to the true meaning of scripture in the law and gospel compar'd …,"Milton, John",,,1644,s.n.,#VALUE!,"82p. ""Now the second time revis'd and much augmented in two books""--t.p.",navy quarter calf over cloth boards with gilt title on spine.,Yes,B75,Special Collections,http://www.worldcat.org/oclc/1066835555,https://idiscover.lib.cam.ac.uk/permalink/f/t9gok8/44CAM_ALMA21297545400003606,,,,,,,,,,,
Areopagitica : a speech of Mr. John Milton for the liberty of unlicenc'd printing to the Parliament of England.,"Milton, John",,,1644,s.n.,#VALUE!,40p.,"Bound in brown leather with gilt panelling, gilt titling, tooling and raised bands on spine, gilt foredges. Bookplate of Hannah D Rabinowitz on front inner pastedown. ",Yes,B64,,,https://idiscover.lib.cam.ac.uk/permalink/f/t9gok8/44CAM_CON_TRImig10000141104,,,,,,,,,,,
The iudgement of Martin Bucer concerning divorce : writt'n to Edward the sixt in his second book of the Kingdom of Christ and now Englisht : wherin a late book restoring the doctrine and discipline of divorce is heer confirm'd and justify'd by the authoritie of Martin Bucer to the Parlament of England.,"Bucer, Martin",,,1644,,#VALUE!,[26]p.,Bound in navy morocco with gilt lettering on spine. Dentelles on inner covers. Bookplate of John Camp Williams on front pastedown. Sale listing pasted on back pastedown. ,,B86,Special Collections,,,,,,,,,,,,,
The doctrine & discipline of divorce : restor'd to the good of both sexes from the bondage of canon law and other mistakes to the true meaning of scripture in the law and gospel compar'd ...,"Milton, John",,,1645,s.n.,#VALUE!,"82p. ""Now the second time revis'd and much augmented in two books""--t.p.",Brown mottled calf with gilt rulings and tooling on spine. ,Yes,B76,Special Collections,,https://idiscover.lib.cam.ac.uk/permalink/f/t9gok8/44CAM_ALMA21297521240003606,,,,,,,,,,,
The doctrine and discipline of divorce : restor'd to the good of both sexes from the bondage of canon law and other mistakes to the true meaning of scripture in the law and gospel compar'd …,"Milton, John",,,1645,s.n.,#VALUE!,"78p. ""Now the second time revis'd and much augmented in two books""--t.p.","Blue Half-goatskin over marbled cloth with gilt rulings, gilt titling on spine. ",Yes,B77,Special Collections,http://www.worldcat.org/oclc/1066851831,https://idiscover.lib.cam.ac.uk/permalink/f/t9gok8/44CAM_ALMA21297521240003606,,,,,,,,,,,
Poems of Mr. John Milton : both English and Latin : compos'd at several times.,"Milton, John",,,1645,"printed by Ruth Raworth for Humphrey Moseley, and are to be sold at the signe of the Princes Arms in S. Pauls Church-yard, 1645.",#VALUE!,"From Cambridge notes: Latin poems preceded by separate t. p., 'Joannis Miltoni Londinensis poemata' and verses addressed to Milton in Latin and Italian.",Bound with A129a?,Yes,A129,Special Collections,http://www.worldcat.org/oclc/1069287600,https://idiscover.lib.cam.ac.uk/permalink/f/t9gok8/44CAM_ALMA21418313550003606,,,,,,,,,,,
Poems of Mr. John Milton : both English and Latin : compos'd at several times.,"Milton, John",,,1645,Printed by Ruth Raworth for Humphrey Mosely,#VALUE!,,"Bound in brown mottled calf with raised bands on spine, kept in green calf slipcase with gilt panelling and tooling . ",Yes,A130,Special Collections,http://www.worldcat.org/oclc/1069248959,https://idiscover.lib.cam.ac.uk/permalink/f/t9gok8/44CAM_ALMA21418313550003606,,,,,,,,,,,
Johannis Miltoni Londinensis poemata.,"Milton, John",,,1645,Humphredum Moseley,#VALUE!,87p. ,Bound in red morroco with gilt title and raised bands on spine. Decorative tooling on edges of inner boards and gilt foredges. Riviere binding.  ,,A129 / A129a,Special Collections,http://www.worldcat.org/oclc/1069319990,,,,,,,,,,,,
Johannis Miltoni Londinensis poemata.,"Milton, John",,,1645,Humphredum Moseley,Londoni,87p. 1st edition.,"Bound in Morrocco red leath with gilt panel, gilt tooling  and titling on spine with raised bands, gilt foredges. Note on recto of front endpaper reads "" early state of front; was red + backed"". English translation of Epithilamium Damonis written in a contemporary hand on verso of p.87. ",Yes,A129a,Special Collections,http://www.worldcat.org/oclc/1069319991,,,,,,,,,,,,
Johannis Miltoni Londinensis poemata.,"Milton, John",,,1645,Humphredum Moseley,Londoni,1st edition.,,Yes,A130a,Special Collections,http://www.worldcat.org/oclc/1066848615,,,,,,,,,,,,
"Tetrachordon : expositions upon the foure chief places in Scripture which treat of mariage, or nullities in mariage...","Milton, John",,,1645,s.n.,#VALUE!,98p.,Bound in brown quarter leather over marbled boards ,Yes,B156,Special Collections,http://www.worldcat.org/oclc/1069360544,,,,,,,,,,,,
"Tetrachordon : expositions upon the foure chief places in Scripture which treat of mariage, or nullities in mariage...","Milton, John",,,1645,s.n.,London,98p.,Includes pasted description on front pastedown from Sotheby's sale/ ,Yes,B156,Special Collections,,,,,,,,,,,,,
"Epistolae Ho-elianae : familiar letters domestic and forren : divided into six sections partly historicall, politicall, philosophicall upon emergent occasions","Howell, James",,,1645,Humphrey Moseley,London,various paginations,"Bound in dark brown calf with gilt rulings. Raised bands and gilt lettering on spine. Two name inscribed on recto of front endpaper: ""M Bishop""  and ""James Balfour"". Very few marginal annotations throughout. ",Yes,B220,Special Collections,,,,,,,,,,,,,
"Colasterion : a reply to a nameless answer against the doctrine and discipline of divorce : wherein the trivial author of that answer is discover'd, the licenser conferr'd with, and the opinion which they traduce defended","Milton, John",,,1645,s.n.,#VALUE!,27p.,Bound in black goatskin with raised bands on spine with gilt tooling on inner binding. Book plate of Hannah D. Rabinowitz on front pastedown. ,Yes,B65,Special Collections,http://www.worldcat.org/oclc/1066810071,,,,,,,,,,,,
