"Poems on affairs of state : from the time of Oliver Cromwell, to the abdication of K. James the secnd"," George Villiers;  John Wilmot; Denham, John; Marvell, Andrew; Milton, John Dryden, John Sprat, Thomas; Waller, Edmund",,,1697,s.n.,London,"[14], 267, 8 p. ; 19 cm. Bound with B175","Bound in dark brown calf. Gilt lettering over burgundy label and raised bands on spine. Bookplate of [Edmund McClure] on recto of front endpaper. Front pastedown contains several inscriptions, one of which is poem. Contains signature of ""Elizabeth Gabetas"", 1736. Two inscriptions on verso of tp: 1"" Elizabeth Bartaropp, Her book"" 2 ""Whitlamb book 1752, East Drayton"" ",,B174,Special Collections,,,,,,,,,,,,,
"State poems continued : from the time of O. Cromwell, to this present year 1697 ...."," George Villiers;  John Wilmot; Denham, John; Marvell, Andrew; Milton, John Dryden, John Sprat, Thomas; Waller, Edmund",,,1697,s.n.,London,Bound with B174,"Binding information: See B174. Latin inscription on verso of tp. Book also contains ""The Hind and the Panther Transversed"". There is also a lengthy inscription on verso of tp., date February 6th with no year. The preface page contains the note ""Samuel Burton's writing [Laneham?]""'  ",,B175,Special Collections,,,,,,,,,,,,,
Comoedia Joannis Miltoni viri clarissimi quae agebatur in arce ludensi paraphrastice reddita,"Milton, John",,,1698,s.n.,London,47p. Bound with 255a,Bound in dark brown calf with blind tooling on cover. Signature markings of Brent Gration Maxfield on front pastedown. ,,B255,Special Collections,,,,,,,,,,,,,
"The antient and present state of Muscovy containing a geographical, historical and political account of all those nations and territories under the jurisdiction of the present czar : with sculptures, and a new map","Crull, Jodocus",,,1698,Printed for A. Roper,London,342p.,Bound in brown calf with panelling and blind tooling on cover. Raised bands and gilt lettering over red leather label on spine. ,,B291,Special Collections,,,,,,,,,,,,,
`Remarks on the life of Mr. Milton as publish'd by J.T. : with a character of the author and his party.,"Toland, John",,,1699,Printed and sold by J. Nutt,,79p.,"Bound in brown speckled calf with decorative gilt tooling, gilt lettering, and raised bands on spine. ",,B180,Special Collections,,,,,,,,,,,,,
"Amyntor : or, a defence of Milton's life.","Toland, John",,,1699,s.n.,#VALUE!,172p.,"Bound in tan calf with gilt rulling and blind tooling on cover. Gilt tooling , gilt lettering over burgundy goatskin label on spine. ",,B190,Special Collections,,,,,,,,,,,,,
"The life of John Milton : containing besides the history of his works several extraordinary characters of men and books, sects, parties and opinions.","Toland, John",,,1699,Printed by John Darby,London,165p.,Quarter-bound calf over marbled boards with gilt tooling and gilt lettering over red label on spine. Bookplate of Arthur Kay on front pastedown. ,,B191,Special Collections,,,,,,,,,,,,,
A defence of the vindication of K. Charles the Martyr : justifying his majesty's title to Eikon Basilike : in answer to a late pamphlet intituled Amyntor,"Wagstaffe, Thomas",,,1699,Printed by W. Bowyer,London,96p.Bound with 254a,Quarter-bound brown calf over blue boards,,B254a,Special Collections,,,,,,,,,,,,,
A defence of the vindication of K. Charles the Martyr : justifying his majesty's title Eikon Basilike : in answer to a late pamphlet intituled Amyntor.,"Wagstaffe, Thomas",,,1699,Printed by W. Bowyer,London,,Bound in Brown calf with blind tooling and gilt lettering on cover. Gilt lettering over red morocco on spine. ,,B254,Special Collections,,,,,,,,,,,,,
The lives and characters of the English dramatick poets,"Langbaine, Gerard",,,1699,Printed for Tho. Leigh,London,182p.,Bound in brown calf with decorative blind tooling and rulings on cover. Decorative gilt tooling and lettering over red morocco label on spine. Marbled pastedowns. ,,B53,Special Collections,,,,,,,,,,,,,
"Poems on affairs of state from the time of Oliver Cromwell, to the abdication of K. James the second ....","[ George Villiers;  John Wilmot; Denham, John; Marvell, Andrew; Milton, John Dryden, John Sprat, Thomas; Waller, Edmund]",,,1702,s.n.,England,267p. Bound with B177,"Bound in dark brown calf with blind rulings and tooling on cover. Blind tooling, raised bands, and gilt lettering over burgundy label on spine. Bookplate of Thomas Crawhall, a notable mining agent from near Newcastle. ",,B176,Special Collections,,,,,,,,,,,,,
State poems continued : from the time of O. Cromwell to the year 1697.,"[ George Villiers;  John Wilmot; Denham, John; Marvell, Andrew; Milton, John Dryden, John Sprat, Thomas; Waller, Edmund]",,,1702,s.n.,England,264p. Bound with B176,"See B177. Contains inscription on verso of back endpaper ""Jami Bell and Joun = 1766""",,B177,Special Collections,,,,,,,,,,,,,
"Memoirs of the two last years of the reign of that unparallell'd prince of ever blessed memory, King Charles I","Herbert, Thomas",,,1702,Printed for Robert Clavell,London,303p.,"Bound in speckled burgundy leather. Gilt lettering over red leather label on spine. Letter on recto of third front endpaper, signed by A. Cleveland…[?], 1837. ",,B290,Special Collections,,,,,,,,,,,,,
Paradise regain'd : a poem in four books : to which is added Samson Agonistes and Poems upon several occasions compos'd at several times,"Milton, John",,,1705,Printed for Jacob Tonson,London,457p. ESTC notes: ’Samson agonistes’ and ’Poems upon several occasions’ each have separate titlepages. ’Poems upon several occasions’ is of the third edition. The pagination and register are continuous. Includes: ’Comus’. Also issued as part of: ’The poetical works of Mr. John Milton. In two volumes.,"Half-bound brown calf over marbled boards with marbled pastedowns and foredges. Decorative gilt tooling, raised bands, and gilt lettering over red goatskin label on spine. ",,B134,Special Collections,https://worldcat.org/en/title/1051557187,https://idiscover.lib.cam.ac.uk/permalink/f/t9gok8/44CAM_ALMA21424606740003606,Yes,,,,,,,,,,
"Epistolae Ho-elianae : familiar letters domestic and forren : divided into four books partly historical, political, philosophical upon emergent occasions","Howell, James",,,1705,Printed for T.G. and sold by S. Crouch,#VALUE!,"509p. From ESTC notes: A series of epistolary volumes assembled and mainly written while Howell was imprisoned in the Fleet during the 1640s. Cf. ODNB. Another issue of the sheets of ESTC T76052 with a different title page. The words ""historical, political, philosophical,"" on tilte page are printed in a column gathered with a left hand brace. Pages 497-500 omitted in pagination but text and register are continuous.With indexes. Not in Alston, R.C. Bibliography of the English language from the invention of printing to the year 1800.",Bound in Dark brown calf with blind stamping and tooling on spine. Gilt lettering over red morocco label on spine.,,A193,Special Collections,https://worldcat.org/en/title/1069339506,https://idiscover.lib.cam.ac.uk/permalink/f/t9gok8/44CAM_ALMA21453794040003606,,,,,,,,,,,
Samson Agonistes : a dramatick poem,"Milton, John",,,1705,Printed for Jacob Tonson,London,180 [i.e. 83] p.,Bound in dark brown cloth with decorative blind tooling on spine. ,,B244,Special Collections,,,,,,,,,,,,,
Paradise lost : a poem in twelve books,"Milton, John",,,1705,s.n.,London,16p.,"Bound in brown speckled calf with gilt lettering over red leather label on spine. Bookplate with the Letter r in centre on front pastedown. Inscription on recto of front endpaper: ""The gift of John Ruggles Esq. to me Bullen. To be presented to my daughter Ann Mary Bullen."" Ann Mary Bullen inscribed on top of tp. ",,B90,Special Collections,,,,,,,,,,,,,
The poetical works of John Milton.,"Milton, John",,,1705,Printed for Jacob Tonson,London,2 volumes,Both volumes Bound in speckled brown calf with gilt rulings on cover. Decorative gilt tooling and gilt lettering over black leather on spine. Marbled pastedowns and foredges. Bookplate of William Mitford on front pastedown. William Mitfords signature on verso of first front endpaper. Second volume contains purchase receipt.,,B257,Special Collections,,,,,,,,,,,,,
Paradise regain'd : a poem in four books : to which is added Samson Agonistes and Poems upon several occasions compos'd at several times,"Milton, John",,,1707,Printed for Jacob Tonson,London,457p. Also issued as part of: ’The poetical works of Mr. John Milton. In two volumes.’ ’Samson Agonistes’. and ’Poems upon several occasions.’ each have separate titlepages. The pagination and register are continuous.,Bound in dark brown calf with gilt tooling on spine. Gilt lettering over red leather label on spine. Unnamed Bookplate on front pastedown. ,,B135,Special Collections,https://worldcat.org/en/title/6497471,https://idiscover.lib.cam.ac.uk/permalink/f/t9gok8/44CAM_ALMA21424599070003606,Yes,,,,,,,,,,
Paradise lost : a poem in twelve books,"Milton, John",,,1707,Printed for Jacob Tonson,London,483p.,Bound in dark burgundy speckled leather with blind rulings on cover. Raised bands and gilt lettering over brown leather label on spine.,,B228,Special Collections,,,,,,,,,,,,,
Cyder : a poem in two books.,"Philips, John",,,1708,Printed for Jacob Tonson,London,89p.,"Bound in brown speckled calf with blind tooling on cover. Raised bands and gilt lettering on spine. "" Albertus Crafoe, Pinhellick, Oct 19th 1888"" inscribed on recto of front endpaper. A slip of paper with sale ad glued to it inserted into front of book"" ",,B246,Special Collections,,,,,,,,,,,,,
"Cyder : a poem in two books : with the Splendid shilling, Paradise lost and two songs, &c.","Philips, John",,,1708,Printed and sold by H. Hills,London,48p.,Half-bound speckled brown calf over marbled boards. Marbled pastedowns. ,,B247,Special Collections,,,,,,,,,,,,,
"Blenheim : a poem inscrib'd to the Right Honourable Robert Harley, Esq.","Philips, John",,,1709,Printed by H. Hills,London,16p.,Bound in paper cover and envelope with printed label on cover. Book label on inner cover of J.L. Weir. ,,A242,Special Collections,https://worldcat.org/en/title/1069465671,https://idiscover.lib.cam.ac.uk/permalink/f/t9gok8/44CAM_ALMA21383173970003606,Yes,,,,,,,,,,
"Milton's sublimity asserted in a poem occasion'd by a late celebrated piece entituled Cyder, a poem : in blank verse","Philips, John",,,1709,Printed for W. Hawes and sold by J. Morphew,London,30p.,30p.,,B165,Special Collections,,,,,,,,,,,,,
A second defense of an argument made use of in a letter to Mr. Dodwel to prove the immateriality and natural immortality of the soul.,"Clarke, Samuel",,,1710,Printed for W.B. for James Knapton,London,48p.,,,B270,Special Collections,,,,,,,,,,,,,
A vindication of K. Charles the martyr proving that his Majesty was the author of Eikon Basilike : against a memorandum said to be written by the Earl of Anglesey : and against the exeptions of Dr. Walker and others.,"Wagstaffe, Thomas",,,1711,Printed for R. Wilkin,London,163p. Bound with 254a,Quarter-bound brown calf over blue boards,,B254,Special Collections,,,,,,,,,,,,,
"A letter to Mr. Dodwell : wherein all the arguments in his Epistolary Discourse against the immortality of the soul are particularly answered, and the judgment of the fathers concerning that matter truly represented …","Clarke, Samuel",,,1711,Printed by Will. Botham for James Knapton,London,"94p. Bound with B269, B270, B271,B272","Bound in cream coloured speckled with blind tooling on cover, Raised bands on spine",,B268,Special Collections,,,,,,,,,,,,,
A defense of an argument made use of in a letter to Mr. Dodwel to prove the immateriality and natural immortality of the soul.,"Clarke, Samuel",,,1712,Printed by W.B. for James Knapton,London,20p.,,,B269,Special Collections,,,,,,,,,,,,,
Paradise regain'd : a poem in four books : to which is added Samson Agonistes and poems upon several occasions with a tractate of education,"Milton, John",,,1713,J. Tonson,#VALUE!,"388 p. From ESTC notes:  'Samson Agonistes.' and 'Poems upon several occasions' each have separate titlepages. The pagination and register are continuous.
Includes: 'Comus'.","Bound navy leather with tooled gold trim and decorative gilt tooling and titling on spine, yellow marbled pastedowns and foredges. ",,A113,Special Collections,https://worldcat.org/en/title/7472409,https://idiscover.lib.cam.ac.uk/permalink/f/t9gok8/44CAM_ALMA21472397450003606,,,,,,,,,,,
"The history of the life of Thomas Ellwood : or an account of his birth, education, &c. ...","Ellis, George",,,1714,Printed and sold by the assigns of J. Sowle,London,"478,80p.",Bound in beige paper over boards with paper label on spine. ,,B22,Special Collections,,,,,,,,,,,,,
The odes and satyrs of Horace : that have been done into English by the most eminent hands / viz. Earl of Rochester [et al.] ; with his Art of poetry / by the Earl of Roscommon.,"Horace; Dillon Roscomon, Earl of Wentworth",,,1717,Jacob Tonson,#VALUE!,203p. ,Bound in brown calf with dotted gilt ruling on cover. Raised bands and gilt lettering over red morocco label on spine. Signature of Donald Edward Edward April 2 1851 on front pastedown,,A192,Special Collections,https://worldcat.org/en/title/1066842595,https://idiscover.lib.cam.ac.uk/permalink/f/t9gok8/44CAM_ALMA21364348490003606,,,,,,,,,,,
The art of English poetry [NEED TO CHECK FOR MULTIPLE VOLUMES IN BINDING] ,"Bysshe, Edward",,,1718,O. Loyd,#VALUE!,288p. Cambridge lists an edition with 2 volumes. UWO 1737 copy is also 2 volumes. ,"Bound in dark brown calf with gilt rulings and gilt centrepiece of lionshead on crown. Decorative gilt tooling, raised bands, and gilt lettering over red morocco label on spine. Marbled pastedowns and red foredges. ",,A179,Special Collections,https://worldcat.org/en/title/1071120213,https://idiscover.lib.cam.ac.uk/permalink/f/t9gok8/44CAM_CON_TRImig10000133326,,,,,,,,,,,
"The works of Mr. Edmund Smith, late of Christ-Church, Oxford: ... To which is prefix'd, A character of Mr. Smith, by Mr. Oldisworth. ","Smith, Edmund",,,1719,Printed for Bernard Lintot,London,"103p. With a frontispiece. Text in English and Latin. From Cambridge notes: With an engraved frontispiece. Head and tail pieces, initials. ""Phaedra and Hippolitus"" has special title-page. Bound with 4 other plays.",Bound with A146a. Bound in quarter calf over marbled boards. Decorative gilt tooling on spine . Gilt titling over black leather label. ,,A146,Special Collections,https://worldcat.org/en/title/1066852626,https://idiscover.lib.cam.ac.uk/permalink/f/t9gok8/44CAM_ALMA21395598700003606,,,,,,,,,,,
"
The works of Mr. Edmund Smith : late of Christ-Church, Oxford.","Smith, Edmund",,,1719,Printed for Bernard Lintot,,103p.,Bound with A146. Bound in quarter calf over marbled boards. Decorative gilt tooling on spine . Gilt titling over black leather label. ,,A146a,Special Collections,https://worldcat.org/en/title/1066852627,https://idiscover.lib.cam.ac.uk/permalink/f/t9gok8/44CAM_ALMA21395598700003606,,,,,,,,,,,
Paradise lost : a poem in twelve books,"Milton, John; Fenton, Elijah; Barrow, Samuel; Marvell, Andrew",,,1719,Jacob Tonson,London,"315p. Contents include: The life of Mr John Milton [by] Elijah Fenton ; Postscript ; In paradisum amissam summi poetae Joannis Miltoni [by] Samuel Barrow ; On Paradise lost [by] Andrew Marvell. From Cambridge notes: With two final advertisement leaves.Pp. 78, 79, 93, 159, 273 misnumbered 76, 78, 39, 156, 293 respectively. Includes index. ESTC Note reads:  These sheets were reissued in 1719 with a different titlepage bearing the imprint: printed for M. Welling. Pp.78,79,93,159,273 misnumbered 76,78,39,156,293 respectively","Bound in speckled brown calf with raised bands on spine. Inscription on recto of first front endpaper: "" William Senhouse & Coll:  Reg: Oxon"" ",,A230,Special Collections,https://worldcat.org/en/title/865061167,https://idiscover.lib.cam.ac.uk/permalink/f/t9gok8/44CAM_CON_TRImig10000135067,,,,,,,,,,,
Poems on several occasions,"Philips, John",,,1720,"Printed for J. Tonson. E. Curll, and T, Jauncy",London,"71p. From Cambridge: This issue contains: 'The life and character of Mr. John Philips. By Mr. Sewell. The third edition', London: E. Curll, 1720; 'Ode ad Henricum St. John'; 'The splendid shilling' with 'Bleinheim'; and 'Cyder,' London: printed for J. T. and sold by Thomas Jauncy. This is different from the other third edition. 'The splendid shilling' and 'Bleinheim' are of a different setting and seem to want titlepages. In this issue the tailpiece to 'Shilling' is a beehive on p.6.",Bound with A145. Bound in marbled boards. ,,A144,Special Collections,https://worldcat.org/en/title/1066845264,https://idiscover.lib.cam.ac.uk/permalink/f/t9gok8/44CAM_ALMA21295728340003606,,,,,,,,,,,
"The whole works of Mr. John Philips, late student of Christ-Church, Oxon. ... : to which is prefixed his life","Philips, john",,,1720,Printed for J. Tonson,London,"89, 13p.",Bound in light brown calf with raised bands and gilt lettering over red leather label on spine. ,,B292,Special Collections,,,,,,,,,,,,,
The life and character of Mr. John Philips,"Sewell, George",,,1720,Printed for E. Curll,London,36p.,Bound with A144. Bound in marbled boards.,,,Special Collections,,,,,,,,,,,,,
"The indictment, arraignment, tryal, and judgment, at large, of twenty-nine regicides, the murtherers of his most sacred majesty King Charles the Ist of glorious memory ....","Finch, Henneage",,,1724,"Printed for J. Walthoe, et al",London,366p.,Bound in brown calf with faint blind tooling on cover. Raised bands and gilt lettering over leather label on spine. Inscription on recto of first front endpaper: William Worth London Jan 30 1723. ,,B277,Special Collections,,,,,,,,,,,,,
Paradise regain'd : a poem in four books : to which is added Samson Agonistes and poems upon several occasions with a tractate of education,"Milton, John",,,1725,J. Tonson,#VALUE!,"352p. 6th edition, corrected. Includes Comus. ",Bound in light brown panelled calf with gilt titling and rasied bands on spine. Bookplate of David R. Young on front inner pastedown ,,A114,Special Collections,https://worldcat.org/en/title/220967928,https://idiscover.lib.cam.ac.uk/permalink/f/t9gok8/44CAM_ALMA21472397450003606,,,,,,,,,,,
"Epistolae Ho-elianae : familiar letters domestick and foreign : divided into four books partly historical, political, philosophical upon emergent occasions","Howell, James",,,1726,"Printed for J. Darby, et al",London,518p.,"Bound in dark brown speckled calf with decorative blind tooling on cover and raised bands on spine. ""John Luje[???tty], A792, 3"" inscribed on recto of first front endpaper""",,B221,Special Collections,,,,,,,,,,,,,
Paradise regain'd : a poem in four books : to which is added Samson Agonistes and Poems upon several occasions with a tractate of education,"Milton, John",,,1727,Printed for Jacob Tonson,London,504p. Cambridge Notes: Added title pages: Samson Agonistes - Poems upon several occasions. With frontispiece. Text in English with sections in Latin,"Bound in brown calf with decorative gilt tooling and gilt lettering over red goatskin label on spine. Inscription on recto of front pastedown ""Gilmert Black""",,B136,Special Collections,https://worldcat.org/en/title/221742363,https://idiscover.lib.cam.ac.uk/permalink/f/t9gok8/44CAM_CON_TRImig10000132584,Yes,,,,,,,,,,
Poems on several occasions,"Bowman, William",,,1727,Printed for the author,London,106p.,Bound in strped blue paper binding with decorative gilt stamping on cover. ,,B6,Special Collections,,,,,,,,,,,,,
"Eikon Basilike: The pourtraiture of His Sacred Majesty King Charles I in His Solitudes and Sufferings. To which is added, The Royal Martyr; or. The Life and Death of the said King. ","Gauden, John; Charles I; Perencheif, Richard. ",,,1727,Printed for D. Browne,#VALUE!,"xiii, 227 p. ; 19 cm.",Bound in brown speckled calf with gilt tooling and raised bands on spine. Folded lithograph tucked into front pages. Contains bookplates of Alvin Dust and the Earl of Ilchester. ,?,DA396.A22 E3 1727,Special Collections,?,,,,,,,,,,,,
Le Paradis perdu de Milton : poëme heroique traduit de l'Anglois : avec les remarques de Mr. Addisson.,"Milton, John; Dupré , N.F.; de Mareuil, Pierre",,,1729,"[Cailleau, et al]",#VALUE!,2 volumes,"Bound in light brown speckled calf. Raised bands, faded gilt tooling, and gilt titling over red morroco label on spine. Both volumes contain bookplate and signature of Charles William Le Geyt, first postmaster of Jersey, dated 1747. ",,A108,Special Collections,https://worldcat.org/en/title/1071705951,N/A,,,,,,,,,,,
Het Paradys verlooren : geschetst na 't Engelsch heldendicht van John Milton,"Milton, John; Paludanus, Lambert",,,1730,Evert Visscher,Amsterdam,416p. Cambridge notes: Engraved half-title.Text in Dutch.,Vellum binding with black print title on spine. ,,B123,Special Collections,https://worldcat.org/en/title/23629087,https://idiscover.lib.cam.ac.uk/permalink/f/t9gok8/44CAM_ALMA21424572770003606,N/A,,,,,,,,,,
"Poems on several occasions : Viz. An ode to Henry Saint John, Esq; The splendid shilling. ... By Mr. John Philips, ... To which is added, his life, by Mr. George Sewell.","Philips, John",,,1730, Printed by S. Powell,Dublin,144p.,Bound in speckled calf. Raised bands with gilt decorative tooling and gilt titling. Bookplate of William Cunningham of Craigens on front pastedown. ,,A147,Special Collections,https://worldcat.org/en/title/221159196,https://idiscover.lib.cam.ac.uk/permalink/f/t9gok8/44CAM_ALMA21470234240003606,,,,,,,,,,,
"
Il Paradiso perduto : poema inglese del signor Milton : tradotto in nostra lingua : al quale se premettono osservazioni....","Milton, John; Mariottini, Felice",,,1730,Alberto Tumermani,Verona,432p. No other copies in Worldcat. Neither Cambridge nor Turnbull have 1730 copy. Coulbe be quite rare. ,Bound in white calf with raised bands and gilt lettering on spine. Bookplate with no name on front pastedown. ,,B126,Special Collections,https://worldcat.org/en/title/1066852884,N/A,N/A,,,,,,,,,,
"England's black tribunall : set forth in the triall of K. Charles I at the pretended Court of Justice at Westminster Hall, Jan. 22 : together with his majesties speech immediately before he was murdred on a scaffold erected at Whitehall-Gate, Tuesday, Jan. 30, 1648.","Milton, John; Addison, Joseph",,,1731,s.n.,#VALUE!,v. 1. Paradise lost / with Mr. Addison's notes --,"Bound in speckled calf with blind tooled rulings with raised bands, gilt lettering over brown goatskin label on spine. ",,A257,Special Collections,,,,,,,,,,,,,
The poetical works of John Milton.,,,,1731,,,,Bound in light brown calf with decorativr gilt tooling on cover. Raised bands on spine. Marbled pastedowns. ,,A258,Special Collections,,,,,,,,,,,,,
Explanatory notes and remarks on Milton's Paradise lost,"Richardson, Jonathan",,,1734,"Printed for James, John, and Paul Knapton",,546p.,"Half-Bound brown calf over marbled boards. Decorative gilt tooling, raised bands, and gilt letter over red morocco label on spine. ",,B181,Special Collections,,,,,,,,,,,,,
Poems on several occasions,"Duck, Stephen",,,1736,Printed for the author,London,[336]p.,"Bound in brown leather with raised bands on spine.Bookplate of Earl of Roden on front pastedown. Initials ""J.G."" inscribed on front pastedown. ",,C2,Special Collections,,,,,,,,,,,,,
"Paradisus Amissa = Paradise lost : poema = a poem, liber primus","Milton, John",,,1736,Typis J. Hughes,London,109p.,Bound in brown calf with gilt rulings on cover. Decorative gilt tooling and raised bands on spine. ,,B128,Special Collections,,,,,,,,,,,,,
The art of English poetry,"Bysshe, Edward",,,1737,"Printed for F. Clay, J. Brotherton, J. R. and J. Hazard, W. Meadows, T. Astley, S. Austen, L. Gilliver, & J. Clarke, C. Corbett, Vand Tho. Payne, Bishopsgate-Street, ",#VALUE!,"Two volumes. A variant edition exists with Thomas Payne's name pasted over. From Cambridge notes: Pts. II and III have each a separate t.-p. The 1714 edition, enlarged, issued under title: The British Parnassus. From ESTC notes: ’A collection of the most natural, agreeable and sublime thoughts’ and ’A dictionary of rhymes’ have additional separate title pages and pagination.
All titlepages dated 1737; some parts may be misbound within the 2 vols. Includes [6]p. of publishers’ lists at end of v.2. There is no comma after ""Gilliver"" in the imprint of v.2. ","Both volumes bound in brown calf with gilt rulings. Raised bands and gilt lettering over red morocco label on spine. Signature of ""W. Hibbs"" on upper right hand corner of recto first endpaper in both volumes. ",,A180,Special Collections,https://worldcat.org/en/title/853654778,https://idiscover.lib.cam.ac.uk/permalink/f/t9gok8/44CAM_ALMA21485878180003606,,,,,,,,,,,
"Epistolae Ho-elianae : familiar letters domestick and foreign : divided into four books partly historical, political, philosophical upon emergent occasions","Howell, James",,,1737,"Printed for D. Midwinter, et al",London,518p.,"Bound in worn lightbrown calf with raised bands and gilt lettering over red leather label on spine. ""Somerset Davies"" inscribed on recto of front endpaper. ",,B222,Special Collections,,,,,,,,,,,,,
"Comus, a mask : (now adapted to the stage) as alter'd from Milton's mask at Ludlow-Castle, which was never represented but on Michaelmas-Day, 1634; before the Rt. Hon. the Earl of Bridgewater ... / the musick was composed by Mr. Henry Lawes.","Dalton, Thomas; ",,,1738,Printed by S. Powell,#VALUE!,64 p. From ESTC notes: Adaptation by John Dalton.,Quarter bound red morocco over red cloth. Gilt lettering on spine. ,,A167,Special Collections,https://worldcat.org/en/title/1071821604,https://idiscover.lib.cam.ac.uk/permalink/f/t9gok8/44CAM_ALMA21413473010003606,,,,,,,,,,,
