"Reliquiae sacrae Carolinae : or the works of that great monarch and glorious martyr King Charles the I : collected together, and digested in order, according to their several subjects, civil and sacred.",,,,1650,,,,Bound in black leather with taped spine. Paperlabel with title written in ink. Frontt pastedown composed of latin text wastepaper. Writing on inside back cover. ,,A181,Special Collections,,,,,,,,,,,,,
The pourtraicture of his sacred majesty in his solitudes and sufferings.,"Gauden, John; Charles I",,,1650,s.n.,#VALUE!,360p.,"Bound with: Reliquiae sacrae Carolinae. Hague : Samuel Browne, 1650. (A8). Bound in extremely worn dark brown leather with raised bands on spine. Front endpaper contains note: "" Eu: Ph: Sn: from the Read R. Morriss from the [Read] Mr Begno[...] sale Sep 19 18[...]4",Yes,A7,Special Collections,http://www.worldcat.org/oclc/1069313721,,,,,,,,,,,,
"Guilielmi Ursino de Rivo vindiciae pro capite regis Angliae contra rebelles parricidas : sive querela nullitatis de impio et injusto processu ac sententia mortis et abdicationis contra serenissimum atque potentissimum Carolum Primum, magnae Britanniae, Franciae et Hiberniae ....",,,,1650,,,55p.,Quarterbound goatskin over marbled boards with gilt lettering on spine. ,,B252,Special Collections,,,,,,,,,,,,,
Eikonoklastes : in answer to a book intitl'd Eikon Basilike the portrature of his sacred majesty in his solitudes and sufferings,"Milton, John",,,1650,Thomas Newcomb,#VALUE!,"230p.  
Publish'd now the second time, and much enlarg'd.","Bound with: B50. Bound in brown calf with gilt title on spine. Front endpaper contains the signature of H. Gibson, the bookstamp of J. Gibson, and ""A.S. Cumming 15[8?] Ainslie Place Edinburgh. There are marginal markings throughout, usually ""X's"" at points of interest. Ocassionally, in a different ink, a reader has amended several words: contented to protested and ladder to former. ",,B50,Special Collections,,,,,,,,,,,,,
"Defensio regia pro Carolo I, ad sereniss Magnae Britanniae regem Carolum II.",,,,1650,,,,Bound in vellum. Faded signature on top of front pastedown. ,,,Special Collections,,,,,,,,,,,,,
A select collection of modern poems by the most eminent hands,,,,1650,,,,Bound in brown calf . Raised bands and gilt tooling on spine. Gilt lettering over red morocco label on spine. ,,,Special Collections,,,,,,,,,,,,,
"Histoire entiere & veritable du procez de Charles Stuart, Roy d'Angleterre.",,,,1650,,,,Bound in very worn black calf. Decorative gilt tooling and letter on spine with raised bands. ,,,Special Collections,,,,,,,,,,,,,
Ioannis Miltoni angli pro populo anglicano defensio.,"Milton, John",,,1651,Typis Du Gardianis,#VALUE!,283p. ,"Bound with Silvii Florus Anglicus. Bound in vellum binding with black paper label and gilt titling on spine, and marbled pastedowns and endpapers. Newspaper clipping of book for sale slipped in between pastedown and board. ",Yes,A43b,Special Collections,https://worldcat.org/en/title/1071767696,https://idiscover.lib.cam.ac.uk/permalink/f/t9gok8/44CAM_ALMA21297551850003606,,,,,,,,,,,
"Joannis Miltoni angli pro populo anglicano defensio : contra Claudii Anonymi, alias Salmasii : defensionem regiam.","Milton, John",,,1651,Typis Du Gardianis,#VALUE!,205p.,"Bound in brown calf with dectorative gilt tooling on front cover and gilt bands and title on spine. Signature on verso of front endpaper reads ""Hugh Muf[?]sell"" ",Yes,B70,Special Collections,https://worldcat.org/en/title/15697941,https://idiscover.lib.cam.ac.uk/permalink/f/t9gok8/44CAM_ALMA21386844340003606,,,,,,,,,,,
"
The none-such Charles his character : extracted out of divers originall transactions, dispatches and the notes of severall publick ministers, and councellours of state as wel at home as abroad.","Gerbier, Balthazar",,,1651,Printed by R.I. and are to be sold by John Collins,#VALUE!,196p. Cambridge notes read: Anonymous. By Sir Balthazar Gerbier.With nine final contents leaves; the last leaf is blank. Engraved frontispiece port. of Charles.,Quarter bound in brown calf over marbled boards. Contains a whole page of notes on recto of portrait of Charles I. Occasional annotations throughout. ,Yes,A250,Special Collections,https://worldcat.org/en/title/1069346461,https://idiscover.lib.cam.ac.uk/permalink/f/t9gok8/44CAM_ALMA21407318070003606,N/A,,,,,,,,,,
"Joannis Miltoni angli defensio pro populo anglicano : contra Claudii Anonimi, alias Salmasii : defensionem regiam.","Milton, John",,,1651,Typis Du Gardianis,#VALUE!,104p.,"Bound with Claudii Salmasii Defensio Regia, Pro Carolo I. Rege Angliae &c. Bound in vellum with gilt title on spine.  ",Yes,B71,Special Collections,https://worldcat.org/en/title/11582806,https://idiscover.lib.cam.ac.uk/permalink/f/t9gok8/44CAM_ALMA21418272330003606,,,,,,,,,,,
Ioannis Miltoni angli pro populo anglicano defensio.,"Milton, John",,,1651,Typis Du Gardianis,#VALUE!,"244p. From Cambridge notes:  The imprint is false. Actually printed in Amsterdam by Louis Elzevir. Cf. F.F. Madan, 6. A reply to: Saumaise, Claude: Defensio regia pro Carolo I.","Bound with A54. Bound in vellum with title written on spine. Inscription at top of tp: ""Robert Southey, London 16, 1825"" as well as an inscription at the bottom of the page: ""J [Hakeberg?]"" ",Yes,A55,Special Collections,https://worldcat.org/en/title/1069332220,https://idiscover.lib.cam.ac.uk/permalink/f/t9gok8/44CAM_ALMA21424626420003606,,,,,,,,,,,
"Joannis Miltoni angli defensio pro populo anglicano : contra Claudii Anonimi, alias Salmasii : defensionem regiam.","Milton, John",,,1651,Typis Du Gardianis,#VALUE!,"260p. From Cambridge notes:  The imprint is false. Actually printed in Amsterdam by Louis Elzevir. Cf. F.F. Madan, 6. A reply to: Saumaise, Claude: Defensio regia pro Carolo I.",Bound in vellum.,Yes,A56,Special Collections,https://worldcat.org/en/title/1069321830,https://idiscover.lib.cam.ac.uk/permalink/f/t9gok8/44CAM_ALMA21425481000003606,,,,,,,,,,,
"Joannis Miltoni angli pro populo anglicano defensio : contra Claudii Anonymi, alias Salmasii : defensionem regiam.","Milton, John",,,1651,Typis Du Gardianis,#VALUE!,"330p. ESTC notes read: A reply to: Saumaise, Claude. Defensio regia pro Carolo I. The imprint is false. Actually printed in Amsterdam by Louis Elzevir. Cf. F.F. Madan, 6. ",Bound in vellum. ,Yes,A57/A62,Special Collections,https://worldcat.org/en/title/977660981,https://idiscover.lib.cam.ac.uk/permalink/f/t9gok8/44CAM_CON_TRImig10000235599,,,,,,,,,,,
"
Joannis Miltoni angli pro populo anglicano defensio : contra Claudii Anonymi, alias Salmasii : defensionem regiam.","Milton, John",,,1651,Typis Du Gardianis,#VALUE!,263p. ,,Yes,C13,Special Collections,,,,,,,,,,,,,
Regii sanguinis clamor ad coelum adversas paricidas anglicanos.,"Du Moulin, Peter",,,1652, Adriani Vlac,The Hague,"148p. From Cambridge: Originally attributed to Alexandre More, who edited the book. It contains an abusive attack on Milton, to which the latter replied in his Defensio secunda ... 1654.","Bound with A218 and A219. Bound in vellum with title written in ink on spine. Half of book plate remains on front pastedown, name is possibly  ""C. Van Baviere"" . ",,A217,Special Collections,https://worldcat.org/en/title/1069295434,https://idiscover.lib.cam.ac.uk/permalink/f/t9gok8/44CAM_ALMA21294773620003606,,,,,,,,,,,
"Eikonoklastes : ou résponse au livre intitulé Eikon Basilike, ou le pourtrait de sa sacrée majesté durant sa solitude & ses souffrances","Milton, John",,,1652,par Guill. Du-Gard,#VALUE!,451p.,"Bound in loose vellum with title written on spine. Recto of front endpapercontains inscription that reads ""Raphael de Seandolera, Geneva, 1666"" ",Yes,A69,Special Collections,https://worldcat.org/en/title/1066836191,https://idiscover.lib.cam.ac.uk/permalink/f/t9gok8/44CAM_ALMA21297528390003606,,,,,,,,,,,
Ioannis Philippi angli responsio ad apologiam anonymi cujusdam tenebrionis pro rege & populo anglicano instantissimam.,"Philips, John",,,1652,Typis Du Gardianis,#VALUE!,"112p. Cambridge notes read:  A defence of John Milton against John Rowland's 'Pro rege et populo Anglicano', 1651. Text revised before publication by Milton (Coleridge).","Bound with A58, A59, A61, A62. Bound with vellum with red foredges. ",Yes,A60,Special Collections,https://worldcat.org/en/title/1069342812,https://idiscover.lib.cam.ac.uk/permalink/f/t9gok8/44CAM_ALMA21336439990003606,,,,,,,,,,,
Joannis Philippi angli responsio ad apologiam anonymt cukusdam tenebrionis pro rege &c populo anglicano instantissimam.,"Philips, John",,,1652,Typis Du Gardianis,#VALUE!,69p.,Bound in marbled paper.,Yes,A153,Special Collections,https://worldcat.org/en/title/1071671389,https://idiscover.lib.cam.ac.uk/permalink/f/t9gok8/44CAM_ALMA21394261430003606,,,,,,,,,,,
"Defensio regia, pro Carolo I. ad serenissimum Magnæ Britanniæ regem Carolvm II. filium natu majorem : haeredem & successorem legitimum","Saumaise, Claude",,,1652,s.n.,[Amsterdam],"499p. Cambridge notes read: Title vignette: Royal Arms of Great Britain. Probably printed by Louis Elzevir at Amsterdam. Listed as no. 13 in F.F. Madan's A revised bibliography of Salmasius's Defensio regia and Milton's Pro populo anglicano defensio (in the Library ; 5th series, v. 9, p. 101-121).",Bound in brown calf with blind tooling on cover. Raised bands and gilt lettering over red morocco label on spine. ,,A238,Special Collections,https://worldcat.org/en/title/1069339558,https://idiscover.lib.cam.ac.uk/permalink/f/t9gok8/44CAM_ALMA21423089900003606,No,,,,,,,,,,
"Ioannis Miltoni angli pro populo anglicano defensio : contra Claudii Anonymi, alias Salmasii : defensionem regiam.","Milton, John",,,1652,Typis Du Gardianis,#VALUE!,192p.,"Bound in brown speckled calf with gilt rulings on cover, gilded decorative tooling and titling on spine with raised bands. Bookplate of William Charles De Meuron, Earl Fitzwilliam on front innner pastedown. ",Yes,A63,Special Collections,https://worldcat.org/en/title/17750038,https://idiscover.lib.cam.ac.uk/permalink/f/t9gok8/44CAM_CON_TRImig10000145272,,,,,,,,,,,
A compendious narrative of the late troubles in England : or Elenchus Englished.,"Bate, George.",,,1652,s.n.,#VALUE!,"300p. From Cambridge notes: A translation of part 1 of: Bate, George. Elenchus motuum nuperorum in Anglia. Place of publication from Wing. The first leaf is blank.",Bound in brown leather. ,,A171,Special Collections,https://worldcat.org/en/title/1066818700,https://idiscover.lib.cam.ac.uk/permalink/f/t9gok8/44CAM_CON_TRImig10000147694,,,,,,,,,,,
Pro rege et populo anglicano apologia : contra Iohannis Polypragmatici (alias Miltoni Angli) defensionem destructivam regis & populi anglicani.,"Rowland, John",,,1652,Hieronymum Verdussen,#VALUE!,175p.,"Bound with A58, A59, A60, A62. Bound in vellum with red foredges. ",Yes,A61,Special Collections,https://worldcat.org/en/title/123209546,https://idiscover.lib.cam.ac.uk/permalink/f/t9gok8/44CAM_CON_TRImig10000168723,,,,,,,,,,,
"Joannis Miltoni angli pro populo anglicano defensio : contra Claudii Anonymi, alias Salmasii : defensionem regiam.","Milton, John",,,1652,Typis Du Gardianis,#VALUE!,278p.,Bound in green marbled calf with gilt title over vellum label on spine. ,Yes,A64,Special Collections,https://worldcat.org/en/title/1066822635,N/A,,,,,,,,,,,
"Defensio regia pro Carolo I, ad serenissimum Magnae Britanniae regem Carolum II.","Saumaise, Claude",,,1652,s.n.,s.l.,,"Bound in dark brown calf with gilt tooling on binding edges. Raised bands on spine. Three leather labels with the numbes 0, 1 , 7 on spine. Marbled foredges. Paper label of ""Cathedral Library"" on front pastedown. ",,A162,Special Collections,,,,,,,,,,,,,
Polemica sive supplementum ad apologiam anonymam pro rege & populo anglicano adversus Jo. Miltoni defensionem populi anglicani : et Iraenica sive cantus receptui ad Christianos omnes,"Rowland, John",,,1653,s.n.,S.l.,125p.,"Bound with A58, A59, A60, A62. Bound with vellum with red foredges. ",Yes,A59,Special Collections,https://worldcat.org/en/title/813731281,https://idiscover.lib.cam.ac.uk/permalink/f/t9gok8/44CAM_ALMA21318593270003606,,,,,,,,,,,
A briefe view of the state of the Church of England as it stood in Q. Elizabeths and King James his reigne to the yeere 1608 ...,"Harington, John ",,,1653,Jos. Kirton,#VALUE!,"211p.  Cambridge notes read:  Another edition has on title-page ""Written by Sir John Harington, ... and now published ... by John Chetwind, ..."". Includes index. According to ESTC, this one of 3 known copies of this variant.",Bound in dark brown leather with imprinted rulings on cover and gilt titling on spine. Second front endpaper contains inscription from Fran. Cholmondeley. Recto of second back endpaper contains two quotations from pages 7 and 13. ,Yes,A248,Special Collections,https://worldcat.org/en/title/1070775806,https://idiscover.lib.cam.ac.uk/permalink/f/t9gok8/44CAM_ALMA21401168050003606,No,,,,,,,,,,
A briefe view of the state of the Church of England as it stood in Q. Elizabeths and King James his reigne to the yeere 1608 …; DUPLICATE?,"Harington, John ",,,1653,,,,Bound in brown leather with blinding rulings and gilt lettering on spine,,A248,Special Collections,,,,,,,,,,,,,
Joannis Miltoni defensio secunda pro populo anglicano : contra infamem libellum anonymum cujus titulus regii sanguinis clamor adversus parricidas anglicanos.,"Milton, John",,,1654,Adriani Vlacq,#VALUE!,"128p. From Cambridge notes: Reply to Pierre Du Moulin's 'Regii sanguinis ... ', 1652, which Milton had mistakenly attributed to Alexander More.","Bound in vellum with title written on spine. Bookplate of C. Van Baviere on front pastedown. Writing on first back endpaper, somewhat illegible "" Molinalum in Angha Catabrigren [?] stellarem magni molinali   filum any thorem cenfent. ",Yes,A219,Special Collections,https://worldcat.org/en/title/1069256235,https://idiscover.lib.cam.ac.uk/permalink/f/t9gok8/44CAM_ALMA21424625320003606,,,,,,,,,,,
Joannis Miltoni angli pro populo anglicano defensio secunda : contra infamem libellum anonymum cui titulus : regii sanguinis clamor ad coelum adversus parricidas anglicanos.,"Milton, John",,,1654,Typis Neucomianis,#VALUE!,173p.,"Bound in brown leather with gilt tooling, titling and raised bands on spine. ",Yes,A166b/A67,Special Collections,https://worldcat.org/en/title/84704418,https://idiscover.lib.cam.ac.uk/permalink/f/t9gok8/44CAM_CON_TRImig10000149345,,,,,,,,,,,
Joannis Miltoni angli defensio secunda pro populo anglicano : contra infamem libellum anonymum cui titulus regii sanguinis clamor ad coelum adversus parricidas anglicanos.,"Milton, John",,,1654,Adriani Vlacq,#VALUE!,128p.,,Yes,A58,Special Collections,https://worldcat.org/en/title/6069340,https://idiscover.lib.cam.ac.uk/permalink/f/t9gok8/44CAM_CON_TRImig10000193129,,,,,,,,,,,
Vavasoris examen & purgamen : or Mr. Vavasor Powells impartiall triall : who being apprehended upon the hue and cry raised after him hath appealed to God and his country and is found not guilty ...,"Allen, Edward",,,1654,Printed for Thomas Brewster and Livewell Chapman,#VALUE!,46p.,Bound with B37,Yes,B42,Special Collections,https://worldcat.org/en/title/1069365328,N/A,,,,,,,,,,,
"Scriptum dom. protectoris reipublicae Angliae, Scotiae, Hiberniae, &c. : ex consensu atque sententia concili sui editum in quo hujus republicae causa contra Hispanos justa esse demonstratur.","Milton, John",,,1655,Excudebant Henricus Hills & Johannes Field,#VALUE!,42p.,Quarter bound red leather over red cloth with gilt title on spine. ,Yes,B150,Special Collections,https://worldcat.org/en/title/936408147,https://idiscover.lib.cam.ac.uk/permalink/f/t9gok8/44CAM_ALMA71412876300003606,,,,,,,,,,,
Ioannis Miltoni angli pro se defensio contra Alexandrum Morum ecclesiasten : libelli famosi cui titulus regii sanguinis clamor ad coelum adversus parricidas anglicanos.,"Milton, John",,,1655,Adriani Vlacq,#VALUE!,211p.,"Quarter bound white cloth over brown paper binding with title written on spine. Red foredges. Bookplate of Bibliotheca Tridentina on front innerpastedown, as well as booksellers ticket in bottom right corner. Inscription on recto of first front endpaper: ""First edition, [illegible] 1916. WPD"" ",Yes,A198,Special Collections,https://worldcat.org/en/title/1069397990,https://idiscover.lib.cam.ac.uk/permalink/f/t9gok8/44CAM_ALMA71424582800003606,,,,,,,,,,,
Joannis Miltoni angli pro se defensio contra Alexandrum Morum ecclesiasten : libelli famosi cui titulus regii sanguinis clamor ad coelum adversus parricidas anglicanos.,"Milton, John",,,1655,Typis Neucomianis,#VALUE!,204p.,,Yes,A166a,Special Collections,https://worldcat.org/en/title/1069360235,https://idiscover.lib.cam.ac.uk/permalink/f/t9gok8/44CAM_CON_TRImig10000149380,,,,,,,,,,,
Joannis Miltoni angli pro se defensio contra Alexandrum Morum ecclesiasten : libelli famosi cui titulus regii sanguinis clamor ad coelum adversus parricidas anglicanos.,"Milton, John",,,1655,Typis Neucomianis,#VALUE!,204p.,Bound with A67. Half brown leather over marbled boards with gilt title and bands on spine. Errata crossed out on final page. ,Yes,A66,Special Collections,https://worldcat.org/en/title/1069264928,https://idiscover.lib.cam.ac.uk/permalink/f/t9gok8/44CAM_CON_TRImig10000149380,,,,,,,,,,,
Ioannis Miltoni angli pro se defensio contra Alexandrum Morum ecclesiasten : libelli famosi cui titulus regii sanguinis clamor ad coelum adversus parricidas anglicanos. [DESPITE DIFFERENT COPY NOTES THIS APPEARS TO BE SAME COPY; NEED TO CHECK],"Milton, John",,,1655,,,,"Bound in green papered boards with white taped spine. Bookplate of Bibliotheca tridentina on front pastedown. Inscription on recto of first front end paper reads ""first edition [….?] 1916. W.P.J. ",,A198,Special Collections,,,,,,,,,,,,,
"Scriptum dom. protectoris reipublicae Angliae, Scotiae, Hiberniae, &c. : ex consensu atque sententia concili sui editum in quo hujus republicae causa contra Hispanos justa esse demonstratur.",,,,1655,,,42p.,,,B150,Special Collections,,,,,,,,,,,,,
Epistolarum liber primus,,,,1656,,,190p. Bound in tan calf with dark brown cover. Bookplate on front pastedown with the name of the memorial hall library at Oxford.  ,B183,,B184,Special Collections,,,,,,,,,,,,,
The cabinet-council : containing the cheif [sic] arts of empire and mysteries of state discabineted : in political and polemical aphorisms grounded on authority and experience : and illustrated with the choicest examples and historical observations,"Raleigh, Walter; Milton, John",,,1658,Printed by Tho. Newcomb for Tho. Johnson,#VALUE!,"199p.  The cabinet council.The arts of empire, and mysteries of state discabineted. Aphorisms of state, grounded on authority and experience.","Bound in light brown calfskin with gilt title on spine. Scribblings in several hands on recto of page containing Raleigh's portrait, including scribblings of Sir Walter's name. minimal marginal scribblings, including a manacle on p. 149.  ",Yes,A49,Special Collections,https://worldcat.org/en/title/64758219,https://idiscover.lib.cam.ac.uk/permalink/f/t9gok8/44CAM_ALMA21424581140003606,,,,,,,,,,,
"Considerations touching the likeliest means to remove hirelings out of the church : wherein is also discourc'd of tithes, church-fees, church-revenues and whether any maintenance of ministers can be settl'd by law","Milton, John",,,1659,Printed by T.N. for L. Chapman,#VALUE!,153p.,32mo. Bound in worn brown calf with rulings on cover. Illegible signature in top right hand corner of tp. ,Yes,B265,Special Collections,https://worldcat.org/en/title/15690937,https://idiscover.lib.cam.ac.uk/permalink/f/t9gok8/44CAM_ALMA21416795430003606,,,,,,,,,,,
A treatise of civil power in ecclesiastical causes : shewing that it is not lawfull for any power on earth to compell in matters of religion,"Milton, John",,,1659,Printed by Tho. Necomb,#VALUE!,83p.,,Yes,A142,Special Collections,https://worldcat.org/en/title/15698053,https://idiscover.lib.cam.ac.uk/permalink/f/t9gok8/44CAM_ALMA21424618970003606,,,,,,,,,,,
"Considerations touching the likeliest means to remove hirelings out of the church : wherein is also discourc'd of tithes, church-fees, church-revenues and whether any maintenance of ministers can be settl'd by law","Milton, John",,,1659,Printed by T.N. for L. Chapman,#VALUE!,153p.,Bound in light brown calf. In brown leath bookcase. ,,B265,Special Collections,,,,,,,,,,,,,
The dignity of kingship asserted : in answer to Mr. Milton's Ready and easie way to establish a free common-wealth …,"Searle, George; Sheldon, Gilbert; Starkey, George",,,1660,Printed by E.C. for H. Selle and for W. Palmer,#VALUE!,"221p. 
Variously attributed to George Searle, Gilbert Sheldon, and George Starkey-- f. Introd.
Reissued under title: Monarchy triumphing over traiterous republicans ... By G.S. ... London : Printed by T.R. for William Palmer, 1661.",Bound in brown speckled calf with rulings and gilt titling over red leather label on spine. ,Yes,DA430.D5,Special Collections,https://worldcat.org/en/title/30302868,https://idiscover.lib.cam.ac.uk/permalink/f/t9gok8/44CAM_ALMA21369919510003606,,,,,,,,,,,
"The readie & easie way to establish a free commonwealth, and the excellence therof compar'd with the inconveniences and dangers of readmitting kingship in this nation","Milton, John",,,1660,Printed by T.N. and are to be sold by Livewell Chapman,#VALUE!,"
14 p. ; 19 cm. Binders title: Way to establish a commonwealth.",Bound in Quarter red calf over red cloth with gilt titling on spine. Missing final two leaves. ,Yes,PR3570.R2 1660,Special Collections,https://worldcat.org/en/title/1105267437,https://idiscover.lib.cam.ac.uk/permalink/f/t9gok8/44CAM_ALMA71386833230003606,,,,,,,,,,,
Ad Johannem Miltonum responsio,"Saumaise, Claude",,,1660,"Jo. Martin, Ja. Allestry, & Tho. Dicas",London,"304p. From Cambridge Notes: A reply to: Milton, John. Pro populo Anglicano defensio. Running title reads: Ad Johannem Miltonum responsio.",Bound in speckled brown calf with blind tooling on cover. Gilt tooling and lettering on spine. Signature of H. Angus on second front endpaper. Signature of J Angus on top of second t.p. ,,A159,Special Collections,https://worldcat.org/en/title/1066844333,https://idiscover.lib.cam.ac.uk/permalink/f/t9gok8/44CAM_CON_TRImig10000148934,,,,,,,,,,,
"An exact and most impartial accompt of the indictment, arraignment, trial, and judgment (according to law) of nine and twenty regicides the murtherers of his late sacred majesty of most glorious memory.","Finch, Henneage",,,1660,Printed for Andrew Cook,London,287p.,Quarter-bound brown calf over marbled boards. Decorative blind tooling on spine. Pe H Johnson inscribed on recto of first front endpaper. Signature of William Hepburn on tp and first page. ,,B23,Special Collections,,,,,,,,,,,,,
"An exact and most impartial accompt of the indictment, arraignment, trial, and judgment (according to law) of twenty nine regicides the murtherers of his late sacred majesty of most glorious memory : begun at Hicks-Hall on Tuesday, the 9th of October, 1660, and continued (at the Sessions-House in the Old-Bayley) until Friday, the nineteenth of the same Moneth.","Finch, Henneage",,,1660,Printed for Andrew Cook,London,287p.,"Quarterbound brown goatskin over brown calf. Rulings on cover. Decorative blind tooling, gilt lettering over red morroco label on spine.",,B288,Special Collections,,,,,,,,,,,,,
The censure of the rote upon Mr. Miltons book entituled The ready and easie way to establish a free common-wealth.,"Harrington, James",,,1660,Printed by Paul Giddy,London,16p.,Quarterbound cloth over marbled boards,,B43,Special Collections,,,,,,,,,,,,,
"No blinde guides : in answer to a seditious pamphlet of J. Milton's intituled Brief notes upon a late sermon titl'd the fear of God and the King : preachd and since publishd by Matthew Griffith, ....","L'Estrange, Robert",,,1660,Printed for Henry Broome,London,14p.,Bound with B57a and B58. Bound in brown mottled calf  with taped spine. ,,B57,Special Collections,,,,,,,,,,,,,
"The life and death of Sir Henry Vane, Kt.","Sikes, George",,,1662,s.n.,London,162p.,Bound with B159,,B158,Special Collections,,,,,,,,,,,,,
"The tryal of Sir Henry Vance, Kt. at Kings Bench, Westminster, June the 2d. and 6th. 1662....","Sikes, George?",,,1662,s.n.,London,134p.,Bound with B158,,B159,Special Collections,,,,,,,,,,,,,
"A memento directed to all those that truly reverence the memory of King Charles the martyr : and as passionately with the honour, safety, and happinnesse of his royall successour our most gratious sovereign Charles the II : the first part","L'Estrange, Robert",,,1662,Printed for Henry Broome,London,251p.,Bound in dark red speckled leather with gilt lettering over red leather label on spine.,,B283,Special Collections,,,,,,,,,,,,,
"The works of King Charles the martyr : with a collection of declarations, treaties, and other papers concerning the differences betwixt his said Majesty and his two houses of Parliament.",Charles I,,,1662,Printed by James Flesher for R. Royston,London,2vols. ,"Both volumes bound in brown marbled calf with decorative gilt tooling on cover. Decorative gilt tooling, raised bands, and gilt lettering over red leather label on spine. Volume 1 has marbled pastedowns. Both volumes have bookplate of Sir Stafford Northcote on front pastedown. Both Volumes have two signatures on recto of first front endpaper: John Blake his booke 1688, and John Symon, his book 1702. ",,C105,Special Collections,,,,,,,,,,,,,
